7.486,"§ 47. Zerstreuung ( distractio ) ist der Zustand einer Abkehrung der Aufmerksamkeit ( abstractio ) von gewissen herrschenden Vorstellungen durch Vertheilung derselben auf andere, ungleichartige. Ist sie vorsetzlich, so heißt sie Dissipation; die unwillkürliche aber ist Abwesenheit ( absentia ) von sich selbst.",
9.962,"Jupiter hat einen Durchmesser von 18920 Meilen. Ein Jahr in ihm beträgt eilf unserer gemeinen Jahre, 315 Tage, 14 Stunden, 27 Minuten und 11 Secunden. Das Sonnenlicht bedarf einer Zeit von 42 Minuten 13 Secunden, ehe es diesen Planeten erreicht.",
7.178,9. Welchen Ertrag wird der Fortschritt zum Besseren dem Menschengeschlecht abwerfen?,
9.941,Aus dieser Bewegung der Erde nun um die Sonne entstehen folgende Kreise:,
4.1220,Durch bloße Anziehungskraft ohne Zurückstoßung ist keine Materie möglich.,
9.378,"Es giebt mehrere Ursachen, durch die das Vorurtheil des Alterthums erzeugt und unterhalten wird.",
9.926,"den Äquator und zwar von Westen nach Osten hin in die bestimmten Grade abtheilt, weil die Bewegung der Erde eben diese ist *).",
9.961,"Mars, der nur 920 Meilen im Durchmesser hält und seinen Umlauf um die Sonne innerhalb 686 Tagen, 23 Stunden und 30 1/2 Minuten zurücklegt, wobei er nur in einer Zeit von 12 Minuten und 22 Secunden das Sonnenlicht erst auffängt.",
9.1555,"Sollte nicht, da nach der Sündfluth der mit Wasser bedeckt gewesene Meeresgrund trocknes Land geworden, der größte Theil seiner Salzigkeit von demselben ausgelaugt sein, dadurch die Salzigkeit des Meeres und die Unfruchtbarkeit des festen Landes entstanden sein würde?",
3.903,Es sind nur drei Beweisarten vom Dasein Gottes aus speculativer Vernunft möglich.,
7.181,10. in welcher Ordnung allein kann der Fortschritt zum Besseren erwartet werden?,
5.826,§ 72. Von den mancherlei Systemen über die Zweckmäßigkeit der Natur.,
5.812,§ 69. Was eine Antinomie der Urtheilskraft sei.,
2.182,1. Nöthige Unterscheidung bei dem Begriffe der Möglichkeit.,
3.414,"1. Was mit den formalen Bedingungen der Erfahrung (der Anschauung und den Begriffen nach) übereinkommt, ist möglich.",
4.350,"1. Was mit den formalen Bedingungen der Erfahrung (der Anschauung und den Begriffen nach) übereinkommt, ist möglich.",
6.840,"2. Fremde Glückseligkeit als Zweck, der zugleich Pflicht ist.",
9.1455,"§. 65. Eintheilung der Winde nach ihren Eigenschaften, Feuchtigkeit, Trockenheit, Wärme, Kälte und Gesundheit.",
6.918,Erster Theil. Von den Pflichten gegen sich selbst überhaupt.,
6.578,III. Der Nachlaß eines guten Namens nach dem Tode. ( Bona fama defuncti. ) § 35.,
3.745,Dies ist der Gegensatz des Epikureisms *) gegen den Platonism.,
4.623,c) Synthetische Urtheile bedürfen ein anderes Prinzip als den Satz des Widerspruchs.,
2.570,§ 2. Die ersten Gründe der Moral sind nach ihrer gegenwärtigen Beschaffenheit noch nicht aller erforderlichen Evidenz fähig.,
6.402,Der allgemeinen Rechtslehre Erster Theil. Das Privatrecht vom äußeren Mein und Dein überhaupt.,
2.378,Erster Abschnitt. Erläuterung des Begriffes von den negativen Größen überhaupt.,
1.1100,"Von den Zwischenzeiten, die binnen einigen auf einander folgenden Erdbeben verlaufen.",
9.1819,Der Stockfischfang auf der großen Bank Terre neuve.,
2.25,"a) Von den Veränderungen, die auf derselben noch fortdauren.",
2.432,Erster Abschnitt. Von den unterschiedenen Gegenständen des Gefühls vom Erhabenen und Schönen.,
