5.915,"Wir haben im vorigen gezeigt, daß wir den Menschen nicht bloß wie alle organisirte Wesen als Naturzweck, sondern auch hier auf Erden als den letzten Zweck der Natur, in Beziehung auf welchen alle übrige Naturdinge ein System von Zwecken ausmachen, nach Grundsätzen der Vernunft zwar nicht für die bestimmende, doch für die reflectirende Urtheilskraft zu beurtheilen hinreichende Ursache haben. Wenn nun dasjenige im Menschen selbst angetroffen werden muß, was als Zweck durch seine Verknüpfung mit der Natur befördert werden soll: so muß entweder der Zweck von der Art sein, daß er selbst durch die Natur in ihrer Wohlthätigkeit befriedigt werden kann; oder es ist die Tauglichkeit und Geschicklichkeit zu allerlei Zwecken, wozu die Natur (äußerlich und innerlich) von ihm gebraucht werden könne. Der erste Zweck der Natur würde die Glückseligkeit, der zweite die Cultur des Menschen sein.",0
9.2295,"Eltern sorgen für das Haus, Fürsten für den Staat. Beide haben nicht das Weltbeste und die Vollkommenheit, dazu die Menschheit bestimmt ist, und wozu sie auch die Anlage hat, zum Endzwecke. Die Anlage zu einem Erziehungsplane muß aber kosmopolitisch gemacht werden. Und ist dann das Weltbeste eine Idee, die uns in unserm Privatbesten kann schädlich sein? Niemals! denn wenn es gleich scheint, daß man bei ihr etwas aufopfern müsse: so befördert man doch nichts desto weniger durch sie immer auch das Beste seines gegenwärtigen Zustandes. Und dann, welche herrliche Folgen begleiten sie! Gute Erziehung gerade ist das, woraus alles Gute in der Welt entspringt. Die Keime, die im Menschen liegen, müssen nur immer mehr entwickelt werden. Denn die Gründe zum Bösen findet man nicht in den Naturanlagen des Menschen. Das nur ist die Ursache des Bösen, daß die Natur nicht unter Regeln gebracht wird. Im Menschen liegen nur Keime zum Guten. *)",0
9.96,"Zu einem Philosophen gehören hauptsächlich zwei Dinge: 1) Cultur des Talents und der Geschicklichkeit, um sie zu allerlei Zwecken zu gebrauchen. 2) Fertigkeit im Gebrauch aller Mittel zu beliebigen Zwecken. Beides muß vereinigt sein; denn ohne Kenntnisse wird man nie ein Philosoph werden, aber nie werden auch Kenntnisse allein den Philosophen ausmachen, wofern nicht eine zweckmäßige Verbindung aller Erkenntnisse und Geschicklichkeiten zur Einheit hinzukommt und eine Einsicht in die Übereinstimmung derselben mit den höchsten Zwecken der menschlichen Vernunft.",0
3.1150,"Ich will das Glück, welches die reine Vernunft in speculativer Absicht macht, jetzt bei Seite setzen und frage nur nach den Aufgaben, deren Auflösung ihren letzten Zweck ausmacht, sie mag diesen nun erreichen oder nicht, und in Ansehung dessen alle andere bloß den Werth der Mittel haben. Diese höchste Zwecke werden nach der Natur der Vernunft wiederum Einheit haben müssen, um dasjenige Interesse der Menschheit, welches keinem höheren untergeordnet ist, vereinigt zu befördern.",6
7.238,"Alle Fortschritte in der Cultur, wodurch der Mensch seine Schule macht, haben das Ziel, diese erworbenen Kenntnisse und Geschicklichkeiten zum Gebrauch für die Welt anzuwenden; aber der wichtigste Gegenstand in derselben, auf den er jene verwenden kann, ist der Mensch: weil er sein eigener letzter Zweck ist. - Ihn also seiner Species nach als mit Vernunft begabtes Erdwesen zu erkennen, verdient besonders Weltkenntniß genannt zu werden, ob er gleich nur einen Theil der Erdgeschöpfe ausmacht.",4
7.786,"Man kann nur dadurch, daß man, nicht was wir uns zum Zweck machen, sondern was Zweck der Natur bei Einrichtung der Weiblichkeit war, als Princip braucht, zu der Charakteristik dieses Geschlechts gelangen, und da dieser Zweck selbst vermittelst der Thorheit der Menschen doch der Naturabsicht nach Weisheit sein muß: so werden diese ihre muthmaßlichen Zwecke auch das Princip derselben anzugeben dienen können, welches nicht von unserer Wahl, sondern von einer höheren Absicht mit dem menschlichen Geschlecht abhängt. Sie sind 1. Die Erhaltung der Art, 2. Die Cultur der Gesellschaft und Verfeinerung derselben durch die Weiblichkeit.",0
9.2319,"Die Pädagogik oder Erziehungslehre ist entweder physisch oder praktisch. Die physische Erziehung ist diejenige, die der Mensch mit den Thieren gemein hat, oder die Verpflegung. Die praktische oder moralische ist diejenige, durch die der Mensch soll gebildet werden, damit er wie ein freihandelndes Wesen leben könne. (Praktisch nennt man alles dasjenige, was Beziehung auf Freiheit hat.) Sie ist Erziehung zur Persönlichkeit, Erziehung eines frei handelnden Wesens, das sich selbst erhalten und in der Gesellschaft ein Glied ausmachen, für sich selbst aber einen innern Werth haben kann.",0
7.137,"Ich habe aus der Kritik der reinen Vernunft gelernt, daß Philosophie nicht etwa eine Wissenschaft der Vorstellungen, Begriffe und Ideen, oder eine Wissenschaft aller Wissenschaften, oder sonst etwas Ähnliches sei; sondern eine Wissenschaft des Menschen, seines Vorstellens, Denkens und Handelns; - sie soll den Menschen nach allen seinen Bestandtheilen darstellen, wie er ist und sein soll, d. h. sowohl nach seinen Naturbestimmungen, als auch nach seinem Moralitäts- und Freiheitsverhältniß. Hier wies nun die alte Philosophie dem Menschen einen ganz unrichtigen Standpunkt in der Welt an, indem sie ihn in dieser zu einer Maschine machte, die als solche gänzlich von der Welt oder von den Außendingen und Umständen abhängig sein mußte; sie machte also den Menschen zu einem beinahe bloß passiven Theile der Welt. - Jetzt erschien die Kritik der Vernunft und bestimmte dem Menschen in der Welt eine durchaus active Existenz. Der Mensch selbst ist ursprünglich Schöpfer aller seiner Vorstellungen und Begriffe und soll einziger Urheber aller seiner Handlungen sein. Jenes ""ist"" und dieses ""soll"" führt auf zwei ganz verschiedene Bestimmungen am Menschen. Wir bemerken daher auch im Menschen zweierlei ganz verschiedenartige Theile, nämlich auf der einen Seite Sinnlichkeit und Verstand und auf der andern Vernunft und freien Willen, die sich sehr wesentlich von einander unterscheiden. In der Natur ist alles; es ist von keinem Soll in ihr die Rede; Sinnlichkeit und Verstand gehen aber nur immer darauf aus, zu bestimmen, was und wie es ist; sie müssen also für die Natur, für diese Erdenwelt, bestimmt sein und mithin zu ihr gehören. Die Vernunft will beständig ins Übersinnliche, wie es wohl über die sinnliche Natur hinaus beschaffen sein möchte: sie scheint also , obzwar ein theoretisches Vermögen, dennoch gar nicht für diese Sinnlichkeit bestimmt zu sein; der freie Wille aber besteht ja in einer Unabhängigkeit von den Außendingen; diese sollen nicht Triebfedern des Handlens für den Menschen sein; er kann also noch weniger zur Natur gehören. Aber wohin denn? Der Mensch muß für zwei ganz verschiedene Welten bestimmt sein, einmal für das Reich der Sinne und des Verstandes, also für diese Erdenwelt: dann aber auch noch für eine andere Welt, die wir nicht kennen, für ein Reich der Sitten.",5
3.949,"Dieser Beweis verdient jederzeit mit Achtung genannt zu werden. Er ist der älteste, klärste und der gemeinen Menschenvernunft am meisten angemessene. Er belebt das Studium der Natur, so wie er selbst von diesem sein Dasein hat und dadurch immer neue Kraft bekommt. Er bringt Zwecke und Absichten dahin, wo sie unsere Beobachtung nicht von selbst entdeckt hätte, und erweitert unsere Naturkenntnisse durch den Leitfaden einer besonderen Einheit, deren Princip außer der Natur ist. Diese Kenntnisse wirken aber wieder auf ihre Ursache, nämlich die veranlassende Idee, zurück und vermehren den Glauben an einen höchsten Urheber bis zu einer unwiderstehlichen Überzeugung.",6
8.37,"Am Menschen (als dem einzigen vernünftigen Geschöpf auf Erden) sollten sich diejenigen Naturanlagen, die auf den Gebrauch seiner Vernunft abgezielt sind, nur in der Gattung, nicht aber im Individuum vollständig entwickeln. Die Vernunft in einem Geschöpfe ist ein Vermögen, die Regeln und Absichten des Gebrauchs aller seiner Kräfte weit über den Naturinstinct zu erweitern, und kennt keine Grenzen ihrer Entwürfe. Sie wirkt aber selbst nicht instinctmäßig, sondern bedarf Versuche, Übung und Unterricht, um von einer Stufe der Einsicht zur andern allmählig fortzuschreiten. Daher würde ein jeder Mensch unmäßig lange leben müssen, um zu lernen, wie er von allen seinen Naturanlagen einen vollständigen Gebrauch machen solle; oder wenn die Natur seine Lebensfrist nur kurz angesetzt hat (wie es wirklich geschehen ist), so bedarf sie vielleicht einer unabsehlichen Reihe von Zeugungen, deren eine der andern ihre Aufklärung überliefert, um endlich ihre Keime in unserer Gattung zu derjenigen Stufe der Entwicklung zu treiben, welche ihrer Absicht vollständig angemessen ist. Und dieser Zeitpunkt muß wenigstens in der Idee des Menschen das Ziel seiner Bestrebungen sein, weil sonst die Naturanlagen größtentheils als vergeblich und zwecklos angesehen werden müßten; welches alle praktischen Principien aufheben und dadurch die Natur, deren Weisheit in Beurtheilung aller übrigen Anstalten sonst zum Grundsatze dienen muß, am Menschen allein eines kindischen Spiels verdächtig machen würde.",4
8.629,"Was ist Philosophie, als Lehre, die unter allen Wissenschaften das größte Bedürfniß der Menschen ausmacht?",0
2.213,1. Das nothwendige Wesen ist ein Geist.,0
9.40,Die Logik wird eingetheilt,0
9.245,"Wie Wahrheit möglich sei, das ist leicht einzusehen, da hier der Verstand nach seinen wesentlichen Gesetzen handelt.",0
4.1260,Allgemeiner Zusatz zur Dynamik.,0
9.61,"Was endlich die Geschichte der Logik betrifft, so wollen wir hierüber nur Folgendes anführen:",0
3.694,"Es ist keine Freiheit, sondern alles in der Welt geschieht lediglich nach Gesetzen der Natur.",6
9.2441,"Was ist denn aber Religion? Religion ist das Gesetz in uns, in so fern es durch einen Gesetzgeber und Richter über uns Nachdruck erhält; sie ist eine auf die Erkenntniß Gottes angewandte Moral. Verbindet man Religion nicht mit Moralität, so wird Religion blos zur Gunstbewerbung. Lobpreisungen, Gebete, Kirchengehen sollen nur dem Menschen neue Stärke, neuen Muth zur Besserung geben, oder der Ausdruck eines von der Pflichtvorstellung beseelten Herzens sein. Sie sind nur Vorbereitungen zu guten Werken, nicht aber selbst gute Werke, und man kann dem höchsten Wesen nicht anders gefällig werden, als dadurch daß man ein besserer Mensch werde.",0
5.623,"§ 45. Schöne Kunst ist eine Kunst, sofern sie zugleich Natur zu sein scheint.",0
9.102,"Denn Wissenschaft hat einen innern, wahren Werth nur als Organ der Weisheit. Als solches ist sie ihr aber auch unentbehrlich, so da man wohl behaupten darf: Weisheit ohne Wissenschaft sei ein Schattenri von einer Vollkommenheit, zu der wir nie gelangen werden.",6
7.463,"Ein richtiger Verstand, geübte Urtheilskraft und gründliche Vernunft machen den ganzen Umfang des intellectuellen Erkenntnißvermögens aus; vornehmlich sofern dieses auch als Tüchtigkeit zu Beförderung des Praktischen, d. i. zu Zwecken, beurtheilt wird.",5
9.84,"Man frägt doch immer am Ende, wozu dient das Philosophiren und der Endzweck desselben die Philosophie selbst als Wissenschaft nach dem Schulbegriffe betrachtet?",0
8.681,"Philosophie als Lehre einer Wissenschaft kann so wie jede andere Doctrin zu allerlei beliebigen Zwecken als Werkzeug dienen, hat aber in dieser Hinsicht nur einen bedingten Werth. - Wer dieses oder jenes Product beabsichtigt, muß so oder so dabei zu Werke gehen, und wenn man hiebei nach Principien verfährt, so wird sie auch eine praktische Philosophie heißen können und hat ihren Werth, wie jede andere Waare und Arbeit, womit Verkehr getrieben werden kann.",0
9.86,"Der Vernunftkünstler oder, wie Sokrates ihn nennt, der Philodox, strebt bloß nach speculativem Wissen, ohne darauf zu sehen, wie viel das Wissen zum letzten Zwecke der menschlichen Vernunft beitrage; er giebt Regeln für den Gebrauch der Vernunft zu allerlei beliebigen Zwecken. Der praktische Philosoph, der Lehrer der Weisheit durch Lehre und Beispiel, ist der eigentliche Philosoph. Denn Philosophie ist die Idee einer vollkommenen Weisheit, die uns die letzten Zwecke der menschlichen Vernunft zeigt.",3
9.104,"Philosophie ist die einzige Wissenschaft, die uns diese innere Genugthuung zu verschaffen weiß, denn sie schließt gleichsam den wissenschaftlichen Zirkel und durch sie erhalten sodann erst die Wissenschaften Ordnung und Zusammenhang.",0
9.2302,"4) Muß man auf die Moralisirung sehen. Der Mensch soll nicht blos zu allerlei Zwecken geschickt sein, sondern auch die Gesinnung bekommen, daß er nur lauter gute Zwecke erwähle. Gute Zwecke sind diejenigen, die nothwendigerweise von Jedermann gebilligt werden, und die auch zu gleicher Zeit Jedermanns Zwecke sein können.",0
9.401,"Es giebt Wissenschaften, die keine Hypothesen erlauben, wie z. B. die Mathematik und Metaphysik. Aber in der Naturlehre sind sie nützlich und unentbehrlich.",0
5.928,"Die Physikotheologie ist der Versuch der Vernunft, aus den Zwecken der Natur (die nur empirisch erkannt werden können) auf die oberste Ursache der Natur und ihre Eigenschaften zu schließen. Eine Moraltheologie (Ethikotheologie) wäre der Versuch, aus dem moralischen Zwecke vernünftiger Wesen in der Natur (der a priori erkannt werden kann) auf jene Ursache und ihre Eigenschaften zu schließen.",0
3.55,"Wie ist reine Mathematik möglich? Wie ist reine Naturwissenschaft möglich? Von diesen Wissenschaften, da sie wirklich gegeben sind, läßt sich nun wohl geziemend fragen: wie sie möglich sind; denn daß sie möglich sein müssen, wird durch ihre Wirklichkeit bewiesen. *) Was aber Metaphysik betrifft, so muß ihr bisheriger schlechter Fortgang, und weil man von keiner einzigen bisher vorgetragenen, was ihren wesentlichen Zweck angeht, sagen kann, sie sei wirklich vorhanden, einen jeden mit Grunde an ihrer Möglichkeit zweifeln lassen.",0
9.828,"Anmerkung. Die analytische Methode heißt auch sonst die Methode des Erfindens. Für den Zweck der Popularität ist die analytische, für den Zweck der wissenschaftlichen und systematischen Bearbeitung des Erkenntnisses aber ist die synthetische Methode angemessener.",4
9.137,"Unser Zeitalter ist das Zeitalter der Kritik, und man muß sehen, was aus den kritischen Versuchen unsrer Zeit, in Absicht auf Philosophie und Metaphysik insbesondre, werden wird.",6
5.835,"Was wollen alle jene Systeme? Sie wollen unsere teleologischen Urtheile über die Natur erklären und gehen damit so zu Werke, daß ein Theil die Wahrheit derselben läugnet, mithin sie für einen Idealism der Natur (als Kunst vorgestellt) erklärt; der andere Theil sie als wahr anerkennt und die Möglichkeit einer Natur nach der Idee der Endursachen darzuthun verspricht.",0
9.83,"Philosophie ist also das System der philosophischen Erkenntnisse oder der Vernunfterkenntnisse aus Begriffen. Das ist der Schulbegriff von dieser Wissenschaft. Nach dem Weltbegriffe ist sie die Wissenschaft von den letzten Zwecken der menschlichen Vernunft. Dieser hohe Begriff giebt der Philosophie würde, d. i. einen absoluten Werth. Und wirklich ist sie es auch, die allein nur innern Werth hat, und allen andern Erkenntnissen erst einen Werth giebt.",0
9.2285,"Ein Entwurf zu einer Theorie der Erziehung ist ein herrliches Ideal, und es schadet nichts, wenn wir auch nicht gleich im Stande sind, es zu realisiren. Man muß nur nicht gleich die Idee für schimärisch halten und sie als einen schönen Traum verrufen, wenn auch Hindernisse bei ihrer Ausführung eintreten.",0
8.631,Von den übersinnlichen Gegenständen unserer Erkenntniß.,6
3.714,"Es existirt überall kein schlechthin nothwendiges Wesen weder in der Welt, noch außer der Welt als ihre Ursache.",0
9.1982,1. Quecksilber.,0
9.2188,Das Land Natal,0
7.756,Von der Leitung der Natur zur Physiognomik.,0
7.690,Von dem höchsten physischen Gut.,0
1.452,"Obgleich die bisherige Betrachtungen und Beweise von der Art sind, daß sie, so viel als nur die Natur der",0
9.1510,Noch immer verändert sich die Gestalt der Erde und zwar vorzüglich durch folgende Ursachen:,0
8.618,Von der physischen Wirkung der Philosophie.,0
4.647,Wie sind synthetische Sätze a priori möglich?,0
6.28,"Es liegt aber der Sittenlehre überhaupt viel daran, keine moralische Mitteldinge weder in Handlungen ( adiaphora ) noch in menschlichen Charakteren, so lange es möglich ist, einzuräumen: weil bei einer solchen Doppelsinnigkeit alle Maximen Gefahr laufen, ihre Bestimmtheit und Festigkeit einzubüßen. Man nennt gemeiniglich die, welche dieser strengen Denkungsart zugethan sind (mit einem Namen, der einen Tadel in sich fassen soll, in der That aber Lob ist): Rigoristen; und so kann man ihre Antipoden Latitudinarier nennen. Diese sind also entweder Latitudinarier der Neutralität und mögen Indifferentisten, oder der Coalition und können Synkretisten genannt werden. *)",0
9.1153,"Anmerkung 1. Sind die Naturforscher noch über irgend etwas in Ungewißheit: so ist es die Natur und das Wesen des Lichts, von dem es noch erst zur Evidenz muß erwiesen werden, ob wir es auf einen eigenthümlichen Stoff zurückzuführen haben, oder ob es eine bloße Modification des Wärmestoffes ist, oder ein Accidenz, eine Wirkung u. s. w. anderer Stoffe. Die im Paragraph selbst vorgetragene Eulerische Hypothese hat indessen fast gänzlich ihr Ansehen verloren, und die Newtonische ist dagegen durch die neuesten chemischen Untersuchungen insofern als die wahrscheinlichste erschienen, daß das Licht nämlich etwas Materielles sei, das man als vom Wärmestoffe verschieden zu betrachten hat. Das Umständlichere hierüber findet man bei Gehler a. a. O. Art. Licht im Werke selbst und im Supplementbande unter demselben Artikel.",0
4.400,"Man erlaube mir, die Stelle, welche wir einem Begriffe entweder in der Sinnlichkeit, oder im reinen Verstande ertheilen, den transscendentalen Ort zu nennen. Auf solche Weise wäre die Beurtheilung dieser Stelle, die jedem Begriffe nach Verschiedenheit seines Gebrauchs zukommt, und die Anweisung nach Regeln, diesen Ort allen Begriffen zu bestimmen, die transscendentale Topik; eine Lehre, die vor Erschleichungen des reinen Verstandes und daraus entspringenden Blendwerken gründlich bewahren würde, indem sie jederzeit unterschiede, welcher Erkenntnißkraft die Begriffe eigentlich angehören. Man kann einen jeden Begriff, einen jeden Titel, darunter viele Erkenntnisse gehören, einen logischen Ort nennen. Hierauf gründet sich die logische Topik des Aristoteles, deren sich Schullehrer und Redner bedienen konnten, um unter gewissen Titeln des Denkens nachzusehen, was sich am besten für eine vorliegende Materie schickte, und darüber mit einem Schein von Gründlichkeit zu vernünfteln oder wortreich zu schwatzen.",3
3.30,"Es ist also wenigstens eine der näheren Untersuchung noch benöthigte und nicht auf den ersten Anschein sogleich abzufertigende Frage: ob es ein dergleichen von der Erfahrung und selbst von allen Eindrücken der Sinne unabhängiges Erkenntniß gebe. Man nennt solche Erkenntnisse a priori, und unterscheidet sie von den empirischen, die ihre Quellen a posteriori, nämlich in der Erfahrung, haben.",6
7.803,"Ich habe mich bei diesem Titel der Charakteristik länger aufgehalten, als es für die übrigen Abschnitte der Anthropologie proportionirlich scheinen mag; aber die Natur hat auch in diese ihre Ökonomie einen so reichen Schatz von Veranstaltungen zu ihrem Zweck, der nichts Geringeres ist als die Erhaltung der Art, hinein gelegt, daß bei Gelegenheit näherer Nachforschungen es noch lange Stoff gnug zu Problemen geben wird, die Weisheit der sich nach und nach entwickelnden Naturanlagen zu bewundern und praktisch zu gebrauchen.",6
8.238,"Soviel zur Vertheidigung meines Begriffs von der Ableitung der erblichen Mannigfaltigkeit organischer Geschöpfe einer und derselben Naturgattung ( Species naturalis , so fern sie durch ihr Zeugungsvermögen in Verbindung stehen und von einem Stamme entsprossen sein *) können) zum Unterschiede von der Schulgattung ( Species artificialis , so fern sie unter einem gemeinschaftlichen Merkmale der bloßen Vergleichung stehen), davon die erstere zur Naturgeschichte, die zweite zur Naturbeschreibung gehört. Jetzt noch etwas über das eigne System des Hrn. F. von dem Ursprunge desselben. Darin sind wir beide einig, daß alles in einer Naturwissenschaft natürlich müsse erklärt werden, weil es sonst zu dieser Wissenschaft nicht gehören würde. Diesem Grundsatze bin ich so sorgfältig gefolgt, daß auch ein scharfsinniger Mann (Hr. O. C. R. Büsching in der Recension meiner obgedachten Schrift) wegen der Ausdrücke von Absichten, von Weisheit und Vorsorge etc. der Natur mich zu einem Naturalisten, doch mit dem Beisatze von eigner Art macht, weil ich in Verhandlungen, welche die bloße Naturkenntnisse und, wieweit diese reichen, angehen (wo es ganz schicklich ist, sich teleologisch auszudrücken), es nicht rathsam finde eine theologische Sprache zu führen; um jeder Erkenntnißart ihre Grenzen ganz sorgfältig zu bezeichnen.",0
6.1058,"Wenn von Pflichtgesetzen (nicht von Naturgesetzen) die Rede ist und zwar im äußeren Verhältniß der Menschen gegen einander, so betrachten wir uns in einer moralischen (intelligibelen) Welt, in welcher nach der Analogie mit der physischen die Verbindung vernünftiger Wesen (auf Erden) durch Anziehung und Abstoßung bewirkt wird. Vermöge des Princips der Wechselliebe sind sie angewiesen sich einander beständig zu nähern, durch das der Achtung, die sie einander schuldig sind, sich im Abstande von einander zu erhalten; und sollte eine dieser großen sittlichen Kräfte sinken, ""so würde dann das nichts (der Immoralität) mit aufgesperrtem Schlund der (moralischen) Wesen ganzes Reich wie einen Tropfen Wasser trinken"" (wenn ich mich hier der Worte Hallers, nur in einer anderen Beziehung, bedienen darf).",0
5.678,"Aber an dem Reize und der Gemüthsbewegung, welche die Musik hervorbringt, hat die Mathematik sicherlich nicht den mindesten Antheil; sondern sie ist nur die unumgängliche Bedingung ( conditio sine qua non ) derjenigen Proportion der Eindrücke in ihrer Verbindung sowohl als ihrem Wechsel, wodurch es möglich wird sie zusammen zu fassen und zu verhindern, daß diese einander nicht zerstören, sondern zu einer continuirlichen Bewegung und Belebung des Gemüths durch damit consonirende Affecten und hiemit zu einem behaglichen Selbstgenusse zusammenstimmen.",0
4.217,"Verstand und Urtheilskraft haben demnach ihren Kanon des objectiv gültigen, mithin wahren Gebrauchs in der transscendentalen Logik und gehören also in ihren analytischen Theil. Allein Vernunft in ihren Versuchen, über Gegenstände a priori etwas auszumachen und das Erkenntniß über die Grenzen möglicher Erfahrung zu erweitern, ist ganz und gar dialektisch, und ihre Scheinbehauptungen schicken sich durchaus nicht in einen Kanon, dergleichen doch die Analytik enthalten soll.",6
3.266,"Verstand und Urtheilskraft haben demnach ihren Kanon des objectiv gültigen, mithin wahren Gebrauchs in der transscendentalen Logik und gehören also in ihren analytischen Theil. Allein Vernunft in ihren Versuchen, über Gegenstände a priori etwas auszumachen und das Erkenntniß über die Grenzen möglicher Erfahrung zu erweitern, ist ganz und gar dialektisch, und ihre Scheinbehauptungen schicken sich durchaus nicht in einen Kanon, dergleichen doch die Analytik enthalten soll.",6
7.22,In tiefster Devotion ersterbe ich etc. Die weitere Geschichte des fortwährenden Treibens zu einem sich immer mehr von der Vernunft entfernenden Glauben ist bekannt.,0
2.110,2. Vernünftig ist ein Merkmal der menschlichen Seele;,0
1.479,"Wir sind in dem Mittelpunkte der artigsten Aufgaben, welche die abstracte Mechanik vorher niemals hat gewähren können.",0
3.903,Es sind nur drei Beweisarten vom Dasein Gottes aus speculativer Vernunft möglich.,0
7.374,"Die Trunkenheit ist der widernatürliche Zustand des Unvermögens seine Sinnenvorstellungen nach Erfahrungsgesetzen zu ordnen, so fern er die Wirkung eines übermäßig genommenen Genießmittels ist.",0
2.566,"Vierte Betrachtung. Von der Deutlichkeit und Gewißheit, deren die erste Gründe der natürlichen Gottesgelahrtheit und Moral fähig sind.",0
3.1103,Von der Unmöglichkeit einer sceptischen Befriedigung der mit sich selbst veruneinigten reinen Vernunft.,6
9.1748,"Diese Thiere sind schwärzlich von Farbe oder völlig schwarz. An Größe sind sie den Hunden gleich und unersättlich wegen ihrer geraden Gedärme, daher sie sich auch des Unflathes, wie der Wolf und Löwe, bald entledigen.",0
6.1102,"Würde es mit dem Wohl der Welt überhaupt nicht besser stehen, wenn alle Moralität der Menschen nur auf Rechtspflichten, doch mit der größten Gewissenhaftigkeit eingeschränkt, das Wohlwollen aber unter die Adiaphora gezählt würde? Es ist nicht so leicht zu übersehen, welche Folge es auf die Glückseligkeit der Menschen haben dürfte. Aber in diesem Fall würde es doch wenigstens an einer großen moralischen Zierde der Welt, nämlich der Menschenliebe, fehlen, welche also für sich, auch ohne die Vortheile (der Glückseligkeit) zu berechnen, die Welt als ein schönes moralisches Ganze in ihrer ganzen Vollkommenheit darzustellen erfordert wird.",0
