7.693,"Die stärksten Antriebe der Natur, welche die Stelle der unsichtbar das menschliche Geschlecht durch eine höhere, das physische Weltbeste allgemein besorgende Vernunft (des Weltregierers) vertreten, ohne daß menschliche Vernunft dazu hinwirken darf, sind Liebe zum Leben und Liebe zum Geschlecht; die erstere um das Individuum, die zweite um die Species zu erhalten, da dann durch Vermischung der Geschlechter im Ganzen das Leben unserer mit Vernunft begabten Gattung fortschreitend erhalten wird, unerachtet diese absichtlich an ihrer eigenen Zerstörung (durch Kriege) arbeitet; welche doch die immer an Cultur wachsenden vernünftigen Geschöpfe selbst mitten in Kriegen nicht hindert, dem Menschengeschlecht in kommenden Jahrhunderten einen Glückseligkeitszustand, der nicht mehr rückgängig sein wird, im Prospect unzweideutig vorzustellen.",0
9.553,"Anmerkung 1. Es kann auch theoretische Postulate geben zum Behuf der praktischen Vernunft. Dieses sind theoretische, in praktischer Vernunftabsicht nothwendige Hypothesen, wie die des Daseins Gottes, der Freiheit und einer andern Welt.",6
2.238,"Wenn man bei dergleichen Anordnungen der Natur berechtigt ist nach einem Grunde einer so weit erstreckten Übereinstimmung des Mannigfaltigen zu fragen, soll man es denn weniger sein bei Wahrnehmung des Ebenmaßes und der Einheit in den unendlich vielfältigen Bestimmungen des Raums? Ist diese Harmonie darum weniger befremdlich, weil sie nothwendig ist? Ich halte dafür, sie sei es darum nur desto mehr. Und weil dasjenige Viele, davon jedes seine besondere und unabhängige Nothwendigkeit hätte, nimmermehr Ordnung, Wohlgereimtheit und Einheit in den gegenseitigen Beziehungen haben könnte, wird man dadurch nicht eben sowohl, wie durch die Harmonie in den zufälligen Anstalten der Natur auf die Vermuthung eines obersten Grundes selbst der Wesen der Dinge geführt, da die Einheit des Grundes auch Einheit in dem Umfange aller Folgen veranlaßt?",0
5.19,"Doch da es in diesem philosophischen und kritischen Zeitalter schwerlich mit jenem Empirism ernst sein kann, und er vermuthlich nur zur Übung der Urtheilskraft, und um durch den Contrast die Nothwendigkeit rationaler Principien a priori in ein helleres Licht zu setzen, aufgestellt wird: so kann man es denen doch Dank wissen, die sich mit dieser sonst eben nicht belehrenden Arbeit bemühen wollen.",0
1.856,"Wir haben die bisherige Muthmaßungen treulich an dem Leitfaden der physischen Verhältnisse fortgeführt, welcher sie auf dem Pfade einer vernünftigen Glaubwürdigkeit erhalten hat. Wollen wir uns noch eine Ausschweifung aus diesem Gleise in das Feld der Phantasie erlauben? Wer zeigt uns die Grenze, wo die gegründete Wahrscheinlichkeit aufhört und die willkürlichen Erdichtungen anheben? Wer ist so kühn, eine Beantwortung der Frage zu wagen: ob die Sünde ihre Herrschaft auch in den andern Kugeln des Weltbaues ausübe, oder ob die Tugend allein ihr Regiment daselbst aufgeschlagen?",0
9.13,"Welche Bewandtniß es nun aber auch immer hiermit haben möge, so viel ist ausgemacht: in jedem Fall bleibt die Logik im Innern ihres Bezirkes, was das Wesentliche betrifft, unverändert; und die transscendentale Frage: ob die logischen Sätze noch einer Ableitung aus einem höhern, absoluten Princip fähig und bedürftig sind, kann auf sie selbst und die Gültigkeit und Evidenz ihrer Gesetze so wenig Einfluß haben, als auf die reine Mathematik in Ansehung ihres wissenschaftlichen Gehalts die transscendentale Aufgabe hat: Wie sind synthetische Urtheile a priori in der Mathematik möglich? So wie der Mathematiker als Mathematiker, so kann auch der Logiker als Logiker innerhalb des Bezirks seiner Wissenschaft beim Erklären und Beweisen seinen Gang ruhig und sicher fortgehen, ohne sich um die außer seiner Sphäre liegende transscendentale Frage des Transscendental-Philosophen und Wissenschaftslehrers bekümmern zu dürfen: Wie reine Mathematik oder reine Logik als Wissenschaft möglich sei?",0
5.274,"Hiemit endige ich also mein ganzes kritisches Geschäft. Ich werde ungesäumt zum doctrinalen schreiten, um wo möglich meinem zunehmenden Alter die dazu noch einigermaßen günstige Zeit noch abzugewinnen. Es versteht sich von selbst, daß für die Urtheilskraft darin kein besonderer Theil sei, weil in Ansehung derselben die Kritik statt der Theorie dient; sondern daß nach der Eintheilung der Philosophie in die theoretische und praktische und der reinen in eben solche Theile die Metaphysik der Natur und die der Sitten jenes Geschäft ausmachen werden.",0
3.947,"Würde das höchste Wesen in dieser Kette der Bedingungen stehen, so würde es selbst ein Glied der Reihe derselben sein und eben so, wie die niederen Glieder, denen es vorgesetzt ist, noch fernere Untersuchung wegen seines noch höheren Grundes erfordern. Will man es dagegen von dieser Kette trennen und als ein bloß intelligibeles Wesen nicht in der Reihe der Naturursachen mitbegreifen: welche Brücke kann die Vernunft alsdann wohl schlagen, um zu demselben zu gelangen, da alle Gesetze des Überganges von Wirkungen zu Ursachen, ja alle Synthesis und Erweiterung unserer Erkenntniß überhaupt auf nichts anderes als mögliche Erfahrung, mithin bloß auf Gegenstände der Sinnenwelt gestellt sind und nur in Ansehung ihrer eine Bedeutung haben können?",6
4.928,"Alle Gewerbe, Handwerke und Künste haben durch die Vertheilung der Arbeiten gewonnen, da nämlich nicht einer alles macht, sondern jeder sich auf gewisse Arbeit, die sich ihrer Behandlungsweise nach von andern merklich unterscheidet, einschränkt, um sie in der größten Vollkommenheit und mit mehrerer Leichtigkeit leisten zu können. Wo die Arbeiten so nicht unterschieden und vertheilt werden, wo jeder ein Tausendkünstler ist, da liegen die Gewerbe noch in der größten Barbarei. Aber ob dieses zwar für sich ein der Erwägung nicht unwürdiges Object wäre, zu fragen: ob die reine Philosophie in allen ihren Theilen nicht ihren besondern Mann erheische, um es um das Ganze des gelehrten Gewerbes nicht besser stehen würde, wenn die, so das Empirische mit dem Rationalen dem Geschmacke des Publicums gemäß nach allerlei ihnen selbst unbekannten Verhältnissen gemischt zu verkaufen gewohnt sind, die sich Selbstdenker, andere aber, die den bloß rationalen Theil zubereiten, Grübler nennen, gewarnt würden, nicht zwei Geschäfte zugleich zu treiben, die in der Art, sie zu behandeln, gar sehr verschieden sind, zu deren jedem vielleicht ein besonderes Talent erfordert wird, und deren Verbindung in einer Person nur Stümper hervorbringt: so frage ich hier doch nur, ob nicht die Natur der Wissenschaft es erfordere, den empirischen von dem rationalen Theil jederzeit sorgfältig abzusondern und vor der eigentlichen (empirischen) Physik eine Metaphysik der Natur, vor der praktischen Anthropologie aber eine Metaphysik der Sitten voranzuschicken, die von allem Empirischen sorgfältig gesäubert sein müßten, um zu wissen, wie viel reine Vernunft in beiden Fällen leisten könne, und aus welchen Quellen sie selbst diese ihre Belehrung a priori schöpfe, es mag übrigens das letztere Geschäfte von allen Sittenlehrern (deren Namen Legion heißt) oder nur von einigen, die Beruf dazu fühlen, getrieben werden.",0
5.616,"3) Wird auch Kunst vom Handwerke unterschieden; die erste heißt freie, die andere kann auch Lohnkunst heißen. Man sieht die erste so an, als ob sie nur als Spiel, d. i. Beschäftigung, die für sich selbst angenehm ist, zweckmäßig ausfallen (gelingen) könne; die zweite so, daß sie als Arbeit, d. i. Beschäftigung, die für sich selbst unangenehm (beschwerlich) und nur durch ihre Wirkung (z. B. den Lohn) anlockend ist, mithin zwangsmäßig auferlegt werden kann. Ob in der Rangliste der Zünfte Uhrmacher für Künstler, dagegen Schmiede für Handwerker gelten sollen: das bedarf eines andern Gesichtspunkts der Beurtheilung, als derjenige ist, den wir hier nehmen; nämlich die Proportion der Talente, die dem einen oder anderen dieser Geschäfte zum Grunde liegen müssen. Ob auch unter den sogenannten sieben freien Künsten nicht einige, die den Wissenschaften beizuzählen, manche auch, die mit Handwerken zu vergleichen sind, aufgeführt worden sein möchten: davon will ich hier nicht reden. Daß aber in allen freien Künsten dennoch etwas Zwangsmäßiges, oder, wie man es nennt, ein Mechanismus erforderlich sei, ohne welchen der Geist, der in der Kunst frei sein muß und allein das Werk belebt, gar keinen Körper haben und gänzlich verdunsten würde: ist nicht unrathsam zu erinnern (z. B. in der Dichtkunst die Sprachrichtigkeit und der Sprachreichthum, imgleichen die Prosodie und das Sylbenmaß), da manche neuere Erzieher eine freie Kunst am besten zu befördern glauben, wenn sie allen Zwang von ihr wegnehmen und sie aus Arbeit in bloßes Spiel verwandeln.",0
5.749,"Die Propädeutik zu aller schönen Kunst, sofern es auf den höchsten Grad ihrer Vollkommenheit angelegt ist, scheint nicht in Vorschriften, sondern in der Cultur der Gemüthskräfte durch diejenigen Vorkenntnisse zu liegen, welche man humaniora nennt: vermuthlich weil Humanität einerseits das allgemeine Theilnehmungsgefühl, andererseits das Vermögen sich innigst und allgemein mittheilen zu können bedeutet; welche Eigenschaften, zusammen verbunden, die der Menschheit angemessene Geselligkeit ausmachen, wodurch sie sich von der thierischen Eingeschränktheit unterscheidet. Das Zeitalter sowohl als die Völker, in welchen der rege Trieb zur gesetzlichen Geselligkeit, wodurch ein Volk ein dauerndes gemeines Wesen ausmacht, mit den großen Schwierigkeiten rang, welche die schwere Aufgabe, Freiheit (und also auch Gleichheit) mit einem Zwange (mehr der Achtung und Unterwerfung aus Pflicht als Furcht) zu vereinigen, umgeben; ein solches Zeitalter und ein solches Volk mußte die Kunst der wechselseitigen Mittheilung der Ideen des ausgebildetesten Theils mit dem roheren, die Abstimmung der Erweiterung und Verfeinerung der ersteren zur natürlichen Einfalt und Originalität des letzteren und auf diese Art dasjenige Mittel zwischen der höheren Cultur und der genügsamen Natur zuerst erfinden, welches den richtigen, nach keinen allgemeinen Regeln anzugebenden Maßstab auch für den Geschmack, als allgemeinen Menschensinn, ausmacht.",0
7.537,"§ 58. Ob der Welt durch große Genies im Ganzen sonderlich gedient sei, weil sie doch oft neue Wege einschlagen und neue Aussichten eröffnen, oder ob mechanische Köpfe, wenn sie gleich nicht Epoche machten, mit ihrem alltägigen, langsam am Stecken und Stabe der Erfahrung fortschreitenden Verstande nicht das Meiste zum Wachsthum der Künste und Wissenschaften beigetragen haben (indem sie, wenn gleich keiner von ihnen Bewunderung erregte, doch auch keine Unordnung stifteten), mag hier unerörtert bleiben. - Aber ein Schlag von ihnen, Geniemänner (besser Genieaffen) genannt, hat sich unter jenem Aushängeschilde mit eingedrängt, welcher die Sprache außerordentlich von der Natur begünstigter Köpfe führt, das mühsame Lernen und Forschen für stümperhaft erklärt und den Geist aller Wissenschaft mit dem Griffe gehascht zu haben, ihn aber in kleinen Gaben concentrirt und kraftvoll zu reichen vorgiebt. Dieser Schlag ist, wie der der Quacksalber und Marktschreier den Fortschritten in wissenschaftlicher und sittlicher Bildung sehr nachtheilig, wenn er über Religion, Staatsverhältnisse und Moral gleich dem Eingeweihten oder Machthaber vom Weisheitssitze herab im entscheidenden Tone abspricht und so die Armseligkeit des Geistes zu verdecken weiß. Was ist hiewider anders zu thun, als zu lachen und seinen Gang mit Fleiß, Ordnung und Klarheit geduldig fortzusetzen, ohne auf jene Gaukler Rücksicht zu nehmen?",0
8.70,"Das dritte Buch vergleicht den Bau der Pflanzen und Thiere mit der Organisation der Menschen. Wir können ihm hier, da er die Betrachtungen der Naturbeschreiber zu seiner Absicht nutzt, nicht folgen; nur einige Resultate: ""Durch solche und solche Organen erzeugt sich das Geschöpf aus dem todten Pflanzenleben lebendigen Reiz, und aus der Summe dieses, durch feine Canäle geläutert, das Medium der Empfindung. Das Resultat der Reize wird Trieb, das Resultat der Empfindung Gedanke, ein ewiger Fortgang von organischer Schöpfung, der in jedes lebendige Geschöpf gelegt ward."" Der Verfasser rechnet nicht auf Keime, sondern eine organische Kraft, so bei Pflanzen als Thieren. Er sagt: ""So wie die Pflanze selbst organisch Leben ist, ist auch der Polyp organisch Leben. Es sind daher viele organische Kräfte, die der Vegetation, der Muskelreize, der Empfindung. Je mehr und feinere Nerven, je größer das Gehirn, desto verständiger wird die Gattung. Thierseele ist die Summe aller in einer Organisation wirkenden Kräfte,"" und der Instinct nicht eine besondere Naturkraft, sondern die Richtung, die die Natur jenen sämmtlichen Kräften durch ihre Temperatur gab. Je mehr das eine organische Principium der Natur, das wir jetzt bildend (im Stein), jetzt treibend (in Pflanzen), jetzt empfindend, jetzt künstlich bauend nennen und im Grunde nur eine und dieselbe organische Kraft ist, in mehr Werkzeuge und verschiedentliche Glieder vertheilt ist, je mehr es in denselben eine eigene Welt hat, - desto mehr verschwindet der Instinct, und ein eigner freier Gebrauch der Sinne und Glieder (wie etwa beim Menschen) fängt an. Endlich kommt der Autor zu dem wesentlichen Naturunterschiede des Menschen. ""Der aufrechte Gang des Menschen ist ihm einzig natürlich, ja er ist die Organisation zum ganzen Beruf seiner Gattung und sein unterscheidender Charakter.""",0
8.165,"Nächst dem Instinct zur Nahrung, durch welchen die Natur jedes Individuum erhält, ist der Instinct zum Geschlecht, wodurch sie für die Erhaltung jeder Art sorgt, der vorzüglichste. Die einmal rege gewordene Vernunft säumte nun nicht, ihren Einfluß auch an diesem zu beweisen. Der Mensch fand bald: daß der Reiz des Geschlechts, der bei den Thieren bloß auf einem vorübergehenden, größtentheils periodischen Antriebe beruht, für ihn der Verlängerung und sogar Vermehrung durch die Einbildungskraft fähig sei, welche ihr Geschäft zwar mit mehr Mäßigung, aber zugleich dauerhafter und gleichförmiger treibt, je mehr der Gegenstand den Sinnen entzogen wird, und daß dadurch der Überdru verhütet werde, den die Sättigung einer bloß thierischen Begierde bei sich führt. Das Feigenblatt (V. 7) war also das Product einer weit größeren Äußerung der Vernunft, als sie in der ersteren Stufe ihrer Entwickelung bewiesen hatte. Denn eine Neigung dadurch inniglicher und dauerhafter zu machen, daß man ihren Gegenstand den Sinnen entzieht, zeigt schon das Bewußtsein einiger Herrschaft der Vernunft über Antriebe und nicht bloß, wie der erstere Schritt ein Vermögen ihnen im kleineren oder größeren Umfange Dienste zu leisten. Weigerung war das Kunststück, um von bloß empfundenen zu idealischen Reizen, von der bloß thierischen Begierde allmählig zur Liebe und mit dieser vom Gefühl des bloß Angenehmen zum Geschmack für Schönheit anfänglich nur an Menschen, dann aber auch an der Natur überzuführen. Die Sittsamkeit, eine Neigung durch guten Anstand (Verhehlung dessen, was Geringschätzung erregen könnte) andern Achtung gegen uns einzuflößen, als die eigentliche Grundlage aller wahren Geselligkeit, gab überdem den ersten Wink zur Ausbildung des Menschen als eines sittlichen Geschöpfs. - Ein kleiner Anfang, der aber Epoche macht, indem er der Denkungsart eine ganz neue Richtung giebt, ist wichtiger, als die ganze unabsehliche Reihe von darauf folgenden Erweiterungen der Cultur.",0
7.836,"II. Die pragmatische Anlage der Civilisirung durch Cultur, vornehmlich der Umgangseigenschaften, und der natürliche Hang seiner Art, im gesellschaftlichen Verhältnisse aus der Rohigkeit der bloßen Selbstgewalt herauszugehen und ein gesittetes (wenn gleich noch nicht sittliches), zur Eintracht bestimmtes Wesen zu werden, ist nun eine höhere Stufe. Er ist einer Erziehung sowohl in Belehrung als Zucht (Disciplin) fähig und bedürftig. Hier ist nun (mit oder gegen Rousseau) die Frage: ob der Charakter seiner Gattung ihrer Naturanlage nach sich besser bei der Rohigkeit seiner Natur, als bei den Künsten der Cultur, welche kein Ende absehen lassen, befinden werde. - Zuvörderst muß man anmerken: daß bei allen übrigen sich selbst überlassenen Thieren jedes Individuum seine ganze Bestimmung erreicht, bei den Menschen aber allenfalls nur die Gattung: so daß sich das menschliche Geschlecht nur durch Fortschreiten in einer Reihe unabsehlich vieler Generationen zu seiner Bestimmung empor arbeiten kann; wo das Ziel ihm doch immer noch im Prospecte bleibt, gleichwohl aber die Tendenz zu diesem Endzwecke zwar wohl öfters gehemmt, aber nie ganz rückläufig werden kann.",0
3.1064,"Das große Glück, welches die Vernunft vermittelst der Mathematik macht, bringt ganz natürlicher Weise die Vermuthung zuwege, daß es, wo nicht ihr selbst, doch ihrer Methode auch außer dem Felde der Größen gelingen werde, indem sie alle ihre Begriffe auf Anschauungen bringt, die sie a priori geben kann, und wodurch sie, so zu reden, Meister über die Natur wird: da hingegen reine Philosophie mit discursiven Begriffen a priori in der Natur herum pfuscht, ohne die Realität derselben a priori anschauend und eben dadurch beglaubigt machen zu können. Auch scheint es den Meistern in dieser Kunst an dieser Zuversicht zu sich selbst und dem gemeinen Wesen an großen Erwartungen von ihrer Geschicklichkeit, wenn sie sich einmal hiemit befassen sollten, gar nicht zu fehlen. Denn da sie kaum jemals über ihre Mathematik philosophirt haben (ein schweres Geschäfte!), so kommt ihnen der specifische Unterschied des einen Vernunftgebrauchs von dem andern gar nicht in Sinn und Gedanken. Gangbare und empirisch gebrauchte Regeln, die sie von der gemeinen Vernunft borgen, gelten ihnen dann statt Axiomen. Wo ihnen die Begriffe von Raum und Zeit, womit sie sich (als den einzigen ursprünglichen Quantis ) beschäftigen, herkommen mögen, daran ist ihnen gar nichts gelegen; und eben so scheint es ihnen unnütz zu sein, den Ursprung reiner Verstandesbegriffe und hiemit auch den Umfang ihrer Gültigkeit zu erforschen, sondern nur sich ihrer zu bedienen. In allem diesem thun sie ganz recht, wenn sie nur ihre angewiesene Grenze, nämlich die der Natur, nicht überschreiten. So aber geraten sie unvermerkt von dem Felde der Sinnlichkeit auf den unsicheren Boden reiner und selbst transscendentaler Begriffe, wo der Grund ( instabilis tellus, innabilis unda ) ihnen weder zu stehen, noch zu schwimmen erlaubt, und sich nur flüchtige Schritte thun lassen, von denen die Zeit nicht die mindeste Spur aufbehält, da hingegen ihr Gang in der Mathematik eine Heeresstraße macht, welche noch die späteste Nachkommenschaft mit Zuversicht betreten kann.",0
5.750,"Schwerlich wird ein späteres Zeitalter jene Muster entbehrlich machen: weil es der Natur immer weniger nahe sein wird und sich zuletzt, ohne bleibende Beispiele von ihr zu haben, kaum einen Begriff von der glücklichen Vereinigung des gesetzlichen Zwanges der höchsten Cultur mit der Kraft und Richtigkeit der ihren eigenen Werth fühlenden freien Natur in einem und demselben Volke zu machen im Stande sein möchte.",6
9.2290,"Zwei Erfindungen der Menschen kann man wohl als die schwersten ansehen: die der Regierungs- und die der Erziehungskunst nämlich, und doch ist man selbst in ihrer Idee noch streitig.",0
9.113,"Übrigens kleideten die ersten Philosophen alles in Bilder ein. Denn Poesie, die nichts anderes ist als eine Einkleidung der Gedanken in Bilder, ist älter als die Prose. Man mußte sich daher anfangs selbst bei Dingen, die lediglich Objecte der reinen Vernunft sind, der Bildersprache und poetischen Schreibart bedienen. Pherekydes soll der erste prosaische Schriftsteller gewesen sein.",0
9.132,"Ihre Verbesserung in den neueren Zeiten verdankt aber die Philosophie theils dem größeren Studium der Natur, theils der Verbindung der Mathematik mit der Naturwissenschaft. Die Ordnung, welche durch das Studium dieser Wissenschaften im Denken entstand, breitete sich auch über die besonderen Zweige und Theile der eigentlichen Weltweisheit aus. Der erste und größte Naturforscher der neuern Zeit war Baco von Verulam. Er betrat bei seinen Untersuchungen den Weg der Erfahrung und machte auf die Wichtigkeit und Unentbehrlichkeit der Beobachtungen und Versuche zur Entdeckung der Wahrheit aufmerksam. Es ist übrigens schwer zu sagen, von wo die Verbesserung der speculativen Philosophie eigentlich herkommt. Ein nicht geringes Verdienst um dieselbe erwarb sich Descartes, indem er viel dazu beitrug, dem Denken Deutlichkeit zu geben durch sein aufgestelltes Kriterium der Wahrheit, das er in die Klarheit und Evidenz der Erkenntniß setzte.",0
1.1244,"Der Raum, den ich dieser kurzen Betrachtung bestimmt habe, setzt ihrer weiteren Ausführung Schranken. Ich beschließe dieselbe damit, daß ich den Herren, welche mir die Ehre erzeigen, in meinen gringen Vortrag einiges Vertrauen zu setzen, eröffne, daß ich die Naturwissenschaft über des Herrn D. Eberhards erste Gründe der Naturlehre zu erklären gesonnen sei. Meine Absicht ist nichts vorbei zu lassen, was eine gründliche Einsicht in die wichtige Entdeckungen alter und neuer Zeiten befördern kann, und vornehmlich den unendlichen Vorzug, den die letztere durch die glückliche Anwendung der Geometrie vor jenen erhalten haben, in deutlichen und vollständigen Beispielen zu beweisen. Ich fahre fort in der Mathematik Anleitung zu geben und den Lehrbegriff der Weltweisheit mit der Erläuterung der Meyerschen Vernunftlehre zu eröffnen. Ich werde die Metaphysik über das Handbuch des Herrn Prof. Baumgarten vortragen. Die Schwierigkeiten der Dunkelheit, die dieses nützlichste und gründlichste unter allen Handbüchern seiner Art zu umgeben scheinen, werden, wo ich mich nicht zu sehr schmeichle, durch die Sorgfalt des Vortrags und ausführliche schriftliche Erläuterungen gehoben werden. Mich dünkt, es sei mehr als allzu gewiß, daß nicht die Leichtigkeit, sondern die Nützlichkeit den Werth einer Sache bestimmen müsse, und daß, wie ein sinnreicher Schriftsteller sich ausdrückt, die Stoppeln ohne Mühe oben fließend gefunden werden, wer aber Perlen suchen will, in die Tiefe herabsteigen müsse.",0
9.2309,"Die Erziehung ist entweder eine Privat- oder eine öffentliche Erziehung. Letztere betrifft nur die Information, und diese kann immer öffentlich bleiben. Die Ausübung der Vorschriften wird der erstern überlassen. Eine vollständige öffentliche Erziehung ist diejenige, die beides, Unterweisung und moralische Bildung, vereinigt. Ihr Zweck ist: Beförderung einer guten Privaterziehung. Eine Schule, in der dieses geschieht, nennt man ein Erziehungsinstitut. Solcher Institute können nicht viele und die Anzahl der Zöglinge in denselben kann nicht groß sein, weil sie sehr kostbar sind, und ihre bloße Einrichtung schon sehr vieles Geld erfordert. Es verhält sich mit ihnen, wie mit den Armenhäusern und Hospitälern. Die Gebäude, die dazu erfordert werden, die Besoldung der Directoren, Aufseher und Bedienten nehmen schon die Hälfte von dem dazu ausgesetzten Gelde weg, und es ist ausgemacht, daß, wenn man dieses Geld den Armen in ihre Häuser schickte, sie viel besser verpflegt werden würden. Daher ist es auch schwer, daß andere als blos reicher Leute Kinder an solchen Instituten Theil nehmen können.",0
9.1618,"2. Urtheil des Gehöres. Wenn man die Musik der Europäer mit der der Türken, Chineser, Afrikaner vergleicht, so ist die Verschiedenheit ungemein auffallend. Die Chineser, ob sie sich gleich mit der Musik viele Mühe geben, finden doch an der unsrigen kein Wohlgefallen.",0
9.212,"Um aber wahre Popularität zu lernen, muß man die Alten lesen, z. B. Cicero's philosophische Schriften, die Dichter Horaz , Virgil u. s. w., unter den Neuern Hume , Shaftesbury u. a. m. Männer, die alle vielen Umgang mit der verfeinerten Welt gehabt haben, ohne den man nicht populär sein kann. Denn wahre Popularität erfordert viele praktische Welt- und Menschenkenntniß, Kenntniß von den Begriffen, dem Geschmacke und den Neigungen der Menschen, worauf bei der Darstellung und selbst der Wahl schicklicher, der Popularität angemessener Ausdrücke beständige Rücksicht zu nehmen ist. Eine solche Herablassung (Condescendenz) zu der Fassungskraft des Publicums und den gewohnten Ausdrücken, wobei die scholastische Vollkommenheit nicht hintenan gesetzt, sondern nur die Einkleidung der Gedanken so eingerichtet wird, daß man das Gerüst, das Schulgerechte und Technische von jener Vollkommenheit nicht sehen läßt (so wie man mit Bleistift Linien zieht, auf die man schreibt und sie nachher wegwischt), diese wahrhaft populäre Vollkommenheit des Erkenntnisses ist in der That eine große und seltene Vollkommenheit, die von vieler Einsicht in die Wissenschaft zeigt. Auch hat sie außer vielen andern Verdiensten noch dieses, daß sie einen Beweis für die vollständige Einsicht in eine Sache geben kann. Denn die bloß scholastische Prüfung einer Erkenntniß läßt noch den Zweifel übrig: ob die Prüfung nicht einseitig sei, und ob die Erkenntniß selbst auch wohl einen von allen Menschen ihr zugestandenen Werth habe? Die Schule hat ihre Vorurtheile so wie der gemeine Verstand. Eines verbessert hier das andre. Es ist daher wichtig, ein Erkenntniß an Menschen zu prüfen, deren Verstand an keiner Schule hängt.",6
