9.2310,"Der Zweck solcher öffentlicher Institute ist: die Vervollkommnung der häuslichen Erziehung. Wenn erst nur die Eltern oder andere, die ihre Mitgehülfen in der Erziehung sind, gut erzogen wären: so könnte der Aufwand der öffentlichen Institute wegfallen. In ihnen sollen Versuche gemacht und Subjecte gebildet werden, und so soll aus ihnen dann eine gute häusliche Erziehung entspringen.",0
2.792,"Die Vorlesung, welche ich ankündige, wird mehr eine nützliche Unterhaltung, als eine mühsame Beschäftigung sein; daher die Untersuchung, womit ich diese Ankündigung begleite, zwar etwas für den Verstand, aber mehr wie ein Spiel desselben, als eine tiefe Nachforschung enthalten wird.",0
8.293,Was soll man hier an Herrn Eberhard bezweifeln: die Einsicht oder die Aufrichtigkeit?,0
9.961,"Mars, der nur 920 Meilen im Durchmesser hält und seinen Umlauf um die Sonne innerhalb 686 Tagen, 23 Stunden und 30 1/2 Minuten zurücklegt, wobei er nur in einer Zeit von 12 Minuten und 22 Secunden das Sonnenlicht erst auffängt.",0
7.178,9. Welchen Ertrag wird der Fortschritt zum Besseren dem Menschengeschlecht abwerfen?,6
7.181,10. in welcher Ordnung allein kann der Fortschritt zum Besseren erwartet werden?,5
9.962,"Jupiter hat einen Durchmesser von 18920 Meilen. Ein Jahr in ihm beträgt eilf unserer gemeinen Jahre, 315 Tage, 14 Stunden, 27 Minuten und 11 Secunden. Das Sonnenlicht bedarf einer Zeit von 42 Minuten 13 Secunden, ehe es diesen Planeten erreicht.",0
9.1555,"Sollte nicht, da nach der Sündfluth der mit Wasser bedeckt gewesene Meeresgrund trocknes Land geworden, der größte Theil seiner Salzigkeit von demselben ausgelaugt sein, dadurch die Salzigkeit des Meeres und die Unfruchtbarkeit des festen Landes entstanden sein würde?",0
4.1167,"Die Materie erfüllt einen Raum, nicht durch ihre bloße Existenz, sondern durch eine besondere bewegende Kraft.",0
3.359,"Bei allem Wechsel der Erscheinungen beharrt die Substanz, und das Quantum derselben wird in der Natur weder vermehrt noch vermindert.",0
9.2293,"Ein Princip der Erziehungskunst, das besonders solche Männer, die Pläne zur Erziehung machen, vor Augen haben sollten, ist: Kinder sollen nicht nur dem gegenwärtigen, sondern dem zukünftig möglichen bessern Zustande des menschlichen Geschlechts, das ist: der Idee der Menschheit und deren ganzer Bestimmung angemessen erzogen werden. Dieses Princip ist von großer Wichtigkeit. Eltern erziehen gemeiniglich ihre Kinder nur so, daß sie in die gegenwärtige Welt, sei sie auch verderbt, passen. Sie sollten sie aber besser erziehen, damit ein zukünftiger besserer Zustand dadurch hervorgebracht werde. Es finden sich hier aber zwei Hindernisse:",6
1.635,"Gebt ihr es, sagt allhier der Freigeist, zu, daß, wenn man nützliche und auf Zwecke abzielende Verfassungen aus den allgemeinsten und einfachsten Naturgesetzen herleiten kann, man keine besondere Regierung einer obersten Weisheit nöthig habe: so sehet hier Beweise, die euch auf eurem eigenen Geständnisse ertappen werden. Die ganze Natur, vornehmlich die unorganisirte, ist voll von solchen Beweisen, die zu erkennen geben, daß die sich selbst durch die Mechanik ihrer Kräfte bestimmende Materie eine gewisse Richtigkeit in ihren Folgen habe und den Regeln der Wohlanständigkeit ungezwungen genug thue. Wenn ein Wohlgesinnter, die gute Sache der Religion zu retten, diese Fähigkeit der allgemeinen Naturgesetze bestreiten will, so wird er sich selbst in Verlegenheit setzen und dem Unglauben durch eine schlechte Vertheidigung Anlaß zu triumphiren geben.",0
9.890,"vermittelst der Handlung in der ganzen Welt ein gleichförmiger Zustand erhalten. Hier wird also angezeigt werden müssen, warum und woher ein Land dasjenige im Überflusse hat, dessen ein anderes entbehren muß. Mehr als irgend etwas hat die Handlung die Menschen verfeinert und ihre gegenseitige Bekanntschaft begründet *).",0
6.147,"Es ist nur eine wahre Religion; aber es kann vielerlei Arten des Glaubens geben. - Man kann hinzusetzen, daß in den mancherlei sich der Verschiedenheit ihrer Glaubensarten wegen von einander absondernden Kirchen dennoch eine und dieselbe wahre Religion anzutreffen sein kann.",0
8.603,"Jene Göttin also ahnen zu können, würde ein Ausdruck sein, der nichts mehr bedeutete als: durch sein moralisches Gefühl zu Pflichtbegriffen geleitet zu werden, ehe man noch die Principien, wovon jenes abhängt, sich hat deutlich machen können; welche Ahnung eines Gesetzes, sobald es durch schulgerechte Behandlung in klare Einsicht übergeht, das eigentliche Geschäft der Philosophie ist, ohne welche jener Ausspruch der Vernunft die Stimme eines Orakels *) , welches allerlei Auslegungen ausgesetzt ist, sein würde.",0
9.2387,"Die moralische Cultur muß sich gründen auf Maximen, nicht auf Disciplin. Diese verhindert die Unarten, jene bildet die Denkungsart. Man muß dahin sehen, daß das Kind sich gewöhne, nach Maximen und nicht nach gewissen Triebfedern zu handeln. Durch Disciplin bleibt nur eine Angewohnheit übrig, die doch auch mit den Jahren verlöscht. Nach Maximen soll das Kind handeln lernen, deren Billigkeit es selbst einsieht. Daß dies bei jungen Kindern schwer zu bewirken, und die moralische Bildung daher auch die meisten Einsichten von Seiten der Eltern und der Lehrer erfordere, sieht man leicht ein. *)",0
6.711,"Noch weniger kann Leibeigenschaft und ihre Rechtmäßigkeit von der Überwältigung eines Volks durch Krieg abgeleitet werden, weil man hiezu einen Strafkrieg annehmen müßte. Am allerwenigsten eine erbliche Leibeigenschaft, die überhaupt absurd ist, weil die Schuld aus jemandes Verbrechen nicht anerben kann.",0
9.99,"In der Mathematik verhält sich die Sache anders. Diese Wissenschaft kann man wohl gewissermaßen lernen, denn die Beweise sind hier so evident, daß ein jeder davon überzeugt werden kann; auch kann sie ihrer Evidenz wegen als eine gewisse und beständige Lehre gleichsam aufbehalten werden.",0
4.904,"Der Grundsatz, der meinen Idealism durchgängig regiert und bestimmt, ist dagegen: ""Alles Erkenntniß von Dingen aus bloßem reinen Verstande oder reiner Vernunft ist nichts als lauter Schein, und nur in der Erfahrung ist Wahrheit.""",6
2.36,"Alles wird in schriftlichen summarischen Aufsätzen, welche zur leichteren Wiederholung dieser ohnedem durch ihre Annehmlichkeit die Aufmerksamkeit genug unterhaltenden Wissenschaft dienen sollen, zusammen gefaßt werden.",0
6.607,Übergang von dem Mein und Dein im Naturzustande zu dem im rechtlichen Zustande überhaupt.,0
9.94,"Der Philosoph muß also bestimmen können 1) die Quellen des menschlichen Wissens, 2) den Umfang des möglichen und nützlichen Gebrauchs alles Wissens und endlich 3) die Grenzen der Vernunft.",6
9.874,"Wir können aber beides, Geschichte und Geographie, auch gleichmäßig eine Beschreibung nennen, doch mit dem Unterschiede, daß erstere eine Beschreibung der Zeit, letztere eine Beschreibung dem Raume nach ist.",0
9.447,"Der Umfang oder die Sphäre eines Begriffes ist um so größer, je mehr Dinge unter ihm stehen und durch ihn gedacht werden können.",0
9.2313,"Wie lange aber soll die Erziehung denn dauern? Bis zu der Zeit, da die Natur selbst den Menschen bestimmt hat, sich selbst zu führen; da der Instinct zum Geschlechte sich bei ihm entwickelt; da er selbst Vater werden kann und selbst erziehen soll: ungefähr bis zu dem sechuehnten Jahre. Nach dieser Zeit kann man wohl noch Hülfsmittel der Cultur gebrauchen und eine versteckte Disciplin ausüben, aber keine ordentliche Erziehung mehr.",0
8.346,"Die Eigenschaften der höchsten Weisheit des Welturhebers, wogegen jene Zweckwidrigkeiten als Einwürfe auftreten, sind also auch drei:",0
9.557,"Anmerkung. Wesentliche und allgemeine Momente eines jeden Theorems sind die Thesis und die Demonstration. Den Unterschied zwischen Theoremen und Corollarien kann man übrigens auch darin setzen, daß diese unmittelbar geschlossen, jene dagegen durch eine Reihe von Folgen aus unmittelbar gewissen Sätzen gezogen werden.",0
9.1602,Die Weiber in dem heißesten Erdstriche zeugen von neun oder zehn Jahren an schon Kinder und hören bereits vor dem 25sten auf.,0
9.395,"Eine Hypothese ist ein Fürwahrhalten des Urtheils von der Wahrheit eines Grundes um der Zulänglichkeit der Folgen willen, oder kürzer; das Fürwahrhalten einer Voraussetzung als Grundes.",0
9.304,"Diejenige Art der Deutlichkeit, die nicht durch Analysis, sondern durch Synthesis der Merkmale entspringt, ist die synthetische Deutlichkeit. Und es ist also ein wesentlicher Unterschied zwischen den beiden Sätzen: Einen deutlichen Begriff machen und einen Begriff deutlich machen.",0
9.12,"Unter Voraussetzung einer solchen Dignität, wie sie einem solchen Princip ohne Zweifel zukommen muß, würde demnach die Logik, so wie jede andre Wissenschaft, der Wissenschaftslehre und deren Principien subordinirt sein müssen.",0
2.34,"3) Das Mineralreich, dessen angenehmste und in den menschlichen Nutzen oder Vergnügen am meisten einfließende Merkwürdigkeiten auf eine historische und philosophische Art durchgegangen werden.",0
9.1232,"1. daß die Berge in einer immerwährenden Kette fortgehen und da nicht auf einmal und hintereinander hohe und niedrige Berge anzutreffen sind, sondern daß dieselben nach und nach zu- und abnehmen;",0
3.114,"I. Zuerst wird es nöthig sein, uns so deutlich als möglich zu erklären, was in Ansehung der Grundbeschaffenheit der sinnlichen Erkenntniß überhaupt unsere Meinung sei, um aller Mißdeutung derselben vorzubeugen.",6
9.606,"Anmerkung 1. Die Metathesis der Urtheile durch die Conversion und die durch die Contraposition sind also in so fern einander entgegengesetzt, als jene bloß die Quantität, diese bloß die Qualität verändert.",6
9.512,1) Wenn der Grund ( antecedens ) wahr ist: so ist auch die durch ihn bestimmte Folge ( consequens ) wahr; heißt der modus ponens .,0
5.35,"Alle materiale praktische Principien sind, als solche, insgesammt von einer und derselben Art und gehören unter das allgemeine Princip der Selbstliebe oder eigenen Glückseligkeit.",0
