ID,Absatz,Die Moral ist ein allgemeingültiges Gesetz und daher ein formales Prinzip.
4.1021,"Moralität besteht also in der Beziehung aller Handlung auf die Gesetzgebung, dadurch allein ein Reich der Zwecke möglich ist. Diese Gesetzgebung muß aber in jedem vernünftigen Wesen selbst angetroffen werden und aus seinem Willen entspringen können, dessen Princip also ist: keine Handlung nach einer andern Maxime zu thun, als so, daß es auch mit ihr bestehen könne, daß sie ein allgemeines Gesetz sei, und also nur so, daß der Wille durch seine Maxime sich selbst zugleich als allgemein gesetzgebend betrachten könne. Sind nun die Maximen mit diesem objectiven Princip der vernünftigen Wesen, als allgemein gesetzgebend, nicht durch ihre Natur schon nothwendig einstimmig, so heißt die Nothwendigkeit der Handlung nach jenem Princip praktische Nöthigung, d. i. Pflicht. Pflicht kommt nicht dem Oberhaupte im Reiche der Zwecke, wohl aber jedem Gliede und zwar allen in gleichem Maße zu.",
8.541,"Die Moral ist schon an sich selbst eine Praxis in objectiver Bedeutung, als Inbegriff von unbedingt gebietenden Gesetzen, nach denen wir handeln sollen, und es ist offenbare Ungereimtheit, nachdem man diesem Pflichtbegriff seine Autorität zugestanden hat, noch sagen zu wollen, daß man es doch nicht könne. Denn alsdann fällt dieser Begriff aus der Moral von selbst weg ( ultra posse nemo obligatur ); mithin kann es keinen Streit der Politik als ausübender Rechtslehre mit der Moral als einer solchen, aber theoretischen (mithin keinen Streit der Praxis mit der Theorie) geben: man müßte denn unter der letzteren eine allgemeine Klugheitslehre, d. i. eine Theorie der Maximen verstehen, zu seinen auf Vortheil berechneten Absichten die tauglichsten Mittel zu wählen, d. i. läugnen, daß es überhaupt eine Moral gebe.",
5.150,"Das moralische Gesetz ist nämlich für den Willen eines allervollkommensten Wesens ein Gesetz der Heiligkeit, für den Willen jedes endlichen vernünftigen Wesens aber ein Gesetz der Pflicht, der moralischen Nöthigung, und der Bestimmung der Handlungen desselben durch Achtung für dies Gesetz und aus Ehrfurcht für seine Pflicht. Ein anderes subjectives Princip muß zur Triebfeder nicht angenommen werden, denn sonst kann zwar die Handlung, wie das Gesetz sie vorschreibt, ausfallen, aber da sie zwar pflichtmäßig ist, aber nicht aus Pflicht geschieht, so ist die Gesinnung dazu nicht moralisch, auf die es doch in dieser Gesetzgebung eigentlich ankommt.",
6.332,"Der oberste Grundsatz der Sittenlehre ist also: handle nach einer Maxime, die zugleich als allgemeines Gesetz gelten kann. - jede Maxime, die sich hiezu nicht qualificirt, ist der Moral zuwider.",
6.795,"Die Rechtslehre hatte es blos mit der formalen Bedingung der äußeren Freiheit (durch die Zusammenstimmung mit sich selbst, wenn ihre Maxime zum allgemeinen Gesetz gemacht wurde), d. i. mit dem Recht, zu thun. Die Ethik dagegen giebt noch eine Materie (einen Gegenstand der freien Willkür), einen Zweck der reinen Vernunft, der zugleich als objectiv nothwendiger Zweck, d. i. für den Menschen als Pflicht, vorgestellt wird, an die Hand. - Denn da die sinnlichen Neigungen zu Zwecken (als der Materie der Willkür) verleiten, die der Pflicht zuwider sein können, so kann die gesetzgebende Vernunft ihrem Einfluß nicht anders wehren, als wiederum durch einen entgegengesetzten moralischen Zweck, der also von der Neigung unabhängig a priori gegeben sein muß.",
5.185,"Das moralische Gesetz ist der alleinige Bestimmungsgrund des reinen Willens. Da dieses aber blos formal ist (nämlich allein die Form der Maxime als allgemein gesetzgebend fordert), so abstrahirt es als Bestimmungsgrund von aller Materie, mithin von allem Objecte des Wollens. Mithin mag das höchste Gut immer der ganze Gegenstand einer reinen praktischen Vernunft, d. i. eines reinen Willens, sein, so ist es darum doch nicht für den Bestimmungsgrund desselben zu halten, und das moralische Gesetz muß allein als der Grund angesehen werden, jenes und dessen Bewirkung oder Beförderung sich zum Objecte zu machen. Diese Erinnerung ist in einem so delicaten Falle, als die Bestimmung sittlicher Principien ist, wo auch die kleinste Mißdeutung Gesinnungen verfälscht, von Erheblichkeit. Denn man wird aus der Analytik ersehen haben, daß, wenn man vor dem moralischen Gesetze irgend ein Object unter dem Namen eines Guten als Bestimmungsgrund des Willens annimmt und von ihm dann das oberste praktische Princip ableitet, dieses alsdann jederzeit Heteronomie herbeibringen und das moralische Princip verdrängen würde.",
5.87,"Dagegen giebt das moralische Gesetz, wenn gleich keine Aussicht, dennoch ein schlechterdings aus allen Datis der Sinnenwelt und dem ganzen Umfange unseres theoretischen Vernunftgebrauchs unerklärliches Factum an die Hand, das auf eine reine Verstandeswelt Anzeige giebt, ja diese sogar positiv bestimmt und uns etwas von ihr, nämlich ein Gesetz, erkennen läßt.",
5.63,"Reine Vernunft ist für sich allein praktisch und giebt (dem Menschen) ein allgemeines Gesetz, welches wir das Sittengesetz nennen.",
5.951,"Das moralische Gesetz als formale Vernunftbedingung des Gebrauchs unserer Freiheit verbindet uns für sich allein, ohne von irgend einem Zwecke als materialer Bedingung abzuhängen; aber es bestimmt uns doch auch und zwar a priori einen Endzweck, welchem nachzustreben es uns verbindlich macht: und dieser ist das höchste durch Freiheit mögliche Gut in der Welt.",
5.214,"Das moralische Gesetz führte in der vorhergehenden Zergliederung zur praktischen Aufgabe, welche ohne allen Beitritt sinnlicher Triebfedern, blos durch reine Vernunft vorgeschrieben wird, nämlich der nothwendigen Vollständigkeit des ersten und vornehmsten Theils des höchsten Guts, der Sittlichkeit, und, da diese nur in einer Ewigkeit völlig aufgelöset werden kann, zum Postulat der Unsterblichkeit. Eben dieses Gesetz muß auch zur Möglichkeit des zweiten Elements des höchsten Guts, nämlich der jener Sittlichkeit angemessenen Glückseligkeit, eben so uneigennützig wie vorher, aus bloßer unparteiischer Vernunft, nämlich auf die Voraussetzung des Daseins einer dieser Wirkung adäquaten Ursache führen, d. i. die Existenz Gottes, als zur Möglichkeit des höchsten Guts (welches Object unseres Willens mit der moralischen Gesetzgebung der reinen Vernunft nothwendig verbunden ist) nothwendig gehörig, postuliren. Wir wollen diesen Zusammenhang überzeugend darstellen.",
9.419,"Die Idee ist ein Vernunftbegriff, deren Gegenstand gar nicht in der Erfahrung kann angetroffen werden.",
8.119,Nun ist das Recht zum Verlage ein persönliches bejahendes Recht.,
1.410,"Drittes Hauptstück, welches eine neue Schätzung der lebendigen Kräfte als das wahre Kräftenmaß der Natur darlegt.",
9.1183,"Das Land überhaupt wird eingetheilt in das feste Land und in die Inseln, obgleich jenes auch nichts anders ist als eine große Insel, von deren Grenzen man nur eine dunkle Idee hat.",
9.893,"Der Nutzen dieses Studiums ist sehr ausgedehnt. Es dient zur zweckmäßigen Anordnung unserer Erkenntnisse, zu unserm eignen Vergnügen und gewährt reichen Stoff zu gesellschaftlichen Unterhaltungen.",
4.1316,"Materie ist das Bewegliche, so fern es als ein solches ein Gegenstand der Erfahrung sein kann.",
3.709,"Zu der Welt gehört etwas, das entweder als ihr Theil, oder ihre Ursache ein schlechthin nothwendiges Wesen ist.",
9.772,"Die Beschreibung ist die Exposition eines Begriffs, sofern sie nicht präcis ist.",
3.592,"In dem Verfahren der rationalen Psychologie herrscht ein Paralogism, der durch folgenden Vernunftschluß dargestellt wird.",
4.972,"Die Vorstellung eines objectiven Princips, sofern es für einen Willen nöthigend ist, heißt ein Gebot (der Vernunft), und die Formel des Gebots heißt Imperativ.",
5.306,V. Das Princip der formalen Zweckmäßigkeit der Natur ist ein transscendentales Princip der Urtheilskraft.,
6.475,"Die bürgerliche Verfassung, obzwar ihre Wirklichkeit subjectiv zufällig ist, ist gleichwohl objectiv, d. i. als Pflicht, nothwendig. Mithin giebt es in Hinsicht auf dieselbe und ihre Stiftung ein wirkliches Rechtsgesetz der Natur, dem alle äußere Erwerbung unterworfen ist.",
8.407,"Diese Principien sind nicht sowohl Gesetze, die der schon errichtete Staat giebt, sondern nach denen allein eine Staatserrichtung reinen Vernunftprincipien des äußeren Menschenrechts überhaupt gemäß möglich ist. Also:",
6.378,"1) Der Rechte, als systematischer Lehren, in das Naturrecht, das auf lauter Principien a priori beruht, und das positive (statutarische) Recht, was aus dem Willen eines Gesetzgebers hervorgeht.",
6.853,"Dagegen geht das Princip der Tugendlehre über den Begriff der äußern Freiheit hinaus und verknüpft nach allgemeinen Gesetzen mit demselben noch einen Zweck, den es zur Pflicht macht. Dieses Princip ist also synthetisch. - Die Möglichkeit desselben ist in der Deduction (§ IX ) enthalten.",
9.610,Ein Vernunftschluß ist das Erkenntniß der Nothwendigkeit eines Satzes durch die Subsumtion seiner Bedingung unter eine gegebene allgemeine Regel.,
9.744,"Die Erkenntniß, als Wissenschaft, muß nach einer Methode eingerichtet sein. Denn Wissenschaft ist ein Ganzes der Erkenntniß als System und nicht bloß als Aggregat. Sie erfordert daher eine systematische, mithin nach überlegten Regeln abgefaßte Erkenntniß.",
9.559,"Ein Wahrnehmungsurtheil ist bloß subjectiv, ein objectives Urtheil aus Wahrnehmungen ist ein Erfahrungsurtheil.",
9.1932,"Der Nägeleinbaum ist einem Birnbaume ähnlich, das Nägelein ist seine Frucht.",
5.568,§ 35. Das Princip des Geschmacks ist das subjective Princip der Urtheilskraft überhaupt.,
6.471,§ 14. Der rechtliche Act dieser Erwerbung ist Bemächtigung ( occupatio ).,
5.442,"§ 20. Die Bedingung der Nothwendigkeit, die ein Geschmacksurtheil vorgiebt, ist die Idee eines Gemeinsinnes.",
9.358,Von den vorläufigen Urtheilen müssen die Vorurtheile unterschieden werden.,
6.335,"Gesetz (ein moralisch praktisches) ist ein Satz, der einen kategorischen Imperativ (Gebot) enthält. Der Gebietende ( imperans ) durch ein Gesetz ist der Gesetzgeber ( legislator ). Er ist Urheber ( autor ) der Verbindlichkeit nach dem Gesetze, aber nicht immer Urheber des Gesetzes. Im letzteren Fall würde das Gesetz positiv (zufällig) und willkürlich sein. Das Gesetz, was uns a priori und unbedingt durch unsere eigene Vernunft verbindet, kann auch als aus dem Willen eines höchsten Gesetzgebers, d. i. eines solchen, der lauter Rechte und keine Pflichten hat, (mithin dem göttlichen Willen) hervorgehend ausgedrückt werden, welches aber nur die Idee von einem moralischen Wesen bedeutet, dessen Wille für alle Gesetz ist, ohne ihn doch als Urheber desselben zu denken.",
6.314,"Der Begriff der Freiheit ist ein reiner Vernunftbegriff, der eben darum für die theoretische Philosophie transscendent, d. i. ein solcher ist, dem kein angemessenes Beispiel in irgend einer möglichen Erfahrung gegeben werden kann, welcher also keinen Gegenstand einer uns möglichen theoretischen Erkenntniß ausmacht und schlechterdings nicht für ein constitutives, sondern lediglich als regulatives und zwar nur bloß negatives Princip der speculativen Vernunft gelten kann, im praktischen Gebrauch derselben aber seine Realität durch praktische Grundsätze beweiset, die als Gesetze eine Causalität der reinen Vernunft, unabhängig von allen empirischen Bedingungen (dem Sinnlichen überhaupt) die Willkür zu bestimmen, und einen reinen Willen in uns beweisen, in welchem die sittlichen Begriffe und Gesetze ihren Ursprung haben.",
5.213,"V. Das Dasein Gottes, als ein Postulat der reinen praktischen Vernunft.",
8.555,"Ohne alle Zweifel muß das letztere Princip vorangehen: denn es hat als Rechtsprincip unbedingte Nothwendigkeit, statt dessen das erstere nur unter Voraussetzung empirischer Bedingungen des vorgesetzten Zwecks, nämlich der Ausführung desselben, nöthigend ist, und wenn dieser Zweck (z. B. der ewige Friede) auch Pflicht wäre, so müßte doch diese selbst aus dem formalen Princip der Maximen äußerlich zu handeln abgeleitet worden sein. - Nun ist das erstere Princip, das des politischen Moralisten (das Problem des Staats-, Völker- und Weltbürgerrechts), eine bloße Kunstaufgabe ( problema technicum ), das zweite dagegen, als Princip des moralischen Politikers, welchem es eine sittliche Aufgabe ( problema morale ) ist, im Verfahren von dem anderen himmelweit unterschieden, um den ewigen Frieden, den man nun nicht bloß als physisches Gut, sondern auch als einen aus Pflichtanerkennung hervorgehenden Zustand wünscht, herbeizuführen.",
4.1036,"Autonomie des Willens ist die Beschaffenheit des Willens, dadurch derselbe ihm selbst (unabhängig von aller Beschaffenheit der Gegenstände des Wollens) ein Gesetz ist. Das Princip der Autonomie ist also: nicht anders zu wählen als so, daß die Maximen seiner Wahl in demselben Wollen zugleich als allgemeines Gesetz mit Begriffen seien. Daß diese praktische Regel ein Imperativ sei, d. i. der Wille jedes vernünftigen Wesens an sie als Bedingung nothwendig gebunden sei, kann durch bloße Zergliederung der in ihm vorkommenden Begriffe nicht bewiesen werden, weil es ein synthetischer Satz ist; man müßte über die Erkenntniß der Objecte und zu einer Kritik des Subjects, d. i. der reinen praktischen Vernunft, hinausgehen, denn völlig a priori muß dieser synthetische Satz, der apodiktisch gebietet, erkannt werden können, dieses Geschäft aber gehört nicht in gegenwärtigen Abschnitt. Allein daß gedachtes Princip der Autonomie das alleinige Princip der Moral sei, läßt sich durch bloße Zergliederung der Begriffe der Sittlichkeit gar wohl darthun. Denn dadurch findet sich, daß ihr Princip ein kategorischer Imperativ sein müsse, dieser aber nichts mehr oder weniger als gerade diese Autonomie gebiete.",
5.46,"Die Materie eines praktischen Princips ist der Gegenstand des Willens. Dieser ist entweder der Bestimmungsgrund des letzteren oder nicht. Ist er der Bestimmungsgrund desselben, so würde die Regel des Willens einer empirischen Bedingung (dem Verhältnisse der bestimmenden Vorstellung zum Gefühle der Lust und Unlust) unterworfen, folglich kein praktisches Gesetz sein. Nun bleibt von einem Gesetze, wenn man alle Materie, d. i. jeden Gegenstand des Willens, (als Bestimmungsgrund) davon absondert, nichts übrig, als die bloße Form einer allgemeinen Gesetzgebung. Also kann ein vernünftiges Wesen sich seine subjectiv-praktische Principien, d. i. Maximen, entweder gar nicht zugleich als allgemeine Gesetze denken, oder es muß annehmen, daß die bloße Form derselben, nach der jene sich zur allgemeinen Gesetzgebung schicken, sie für sich allein zum praktischen Gesetze mache.",
5.52,"Da die bloße Form des Gesetzes lediglich von der Vernunft vorgestellt werden kann und mithin kein Gegenstand der Sinne ist, folglich auch nicht unter die Erscheinungen gehört: so ist die Vorstellung derselben als Bestimmungsgrund des Willens von allen Bestimmungsgründen der Begebenheiten in der Natur nach dem Gesetze der Causalität unterschieden, weil bei diesen die bestimmenden Gründe selbst Erscheinungen sein müssen. Wenn aber auch kein anderer Bestimmungsgrund des Willens für diesen zum Gesetz dienen kann, als blos jene allgemeine gesetzgebende Form: so muß ein solcher Wille als gänzlich unabhängig von dem Naturgesetz der Erscheinungen, nämlich dem Gesetze der Causalität, beziehungsweise auf einander gedacht werden. Eine solche Unabhängigkeit aber heißt Freiheit im strengsten, d. i. transscendentalen, Verstande. Also ist ein Wille, dem die bloße gesetzgebende Form der Maxime allein zum Gesetze dienen kann, ein freier Wille.",
5.218,"Die Lehre des Christenthums *) , wenn man sie auch noch nicht als Religionslehre betrachtet, giebt in diesem Stücke einen Begriff des höchsten Guts (des Reichs Gottes), der allein der strengsten Forderung der praktischen Vernunft ein Gnüge thut. Das moralische Gesetz ist heilig (unnachsichtlich) und fordert Heiligkeit der Sitten, obgleich alle moralische Vollkommenheit, zu welcher der Mensch gelangen kann, immer nur Tugend ist, d. i. gesetzmäßige Gesinnung aus Achtung fürs Gesetz, folglich Bewußtsein eines continuirlichen Hanges zur Übertretung, wenigstens Unlauterkeit, d. i. Beimischung vieler unächter (nicht moralischer) Bewegungsgründe zur Befolgung des Gesetzes, folglich eine mit Demuth verbundene Selbstschätzung und also in Ansehung der Heiligkeit, welche das christliche Gesetz fordert, nichts als Fortschritt ins Unendliche dem Geschöpfe übrig läßt, eben daher aber auch dasselbe zur Hoffnung seiner ins Unendliche gehenden Fortdauer berechtigt. Der Werth einer dem moralischen Gesetze völlig angemessenen Gesinnung ist unendlich: weil alle mögliche Glückseligkeit im Urtheile eines weisen und alles vermögenden Austheilers derselben keine andere Einschränkung hat, als den Mangel der Angemessenheit vernünftiger Wesen an ihrer Pflicht. Aber das moralische Gesetz für sich verheißt doch keine Glückseligkeit; denn diese ist nach Begriffen von einer Naturordnung überhaupt mit der Befolgung desselben nicht nothwendig verbunden. Die christliche Sittenlehre ergänzt nun diesen Mangel (des zweiten unentbehrlichen Bestandstücks des höchsten Guts) durch die Darstellung der Welt, darin vernünftige Wesen sich dem sittlichen Gesetze von ganzer Seele weihen, als eines Reichs Gottes, in welchem Natur und Sitten in eine jeder von beiden für sich selbst fremde Harmonie durch einen heiligen Urheber kommen, der das abgeleitete höchste Gut möglich macht. Die Heiligkeit der Sitten wird ihnen in diesem Leben schon zur Richtschnur angewiesen, das dieser proportionirte Wohl aber, die Seligkeit, nur als in einer Ewigkeit erreichbar vorgestellt: weil jene immer das Urbild ihres Verhaltens in jedem Stande sein muß, und das Fortschreiten zu ihr schon in diesem Leben möglich und nothwendig ist, diese aber in dieser Welt unter dem Namen der Glückseligkeit gar nicht erreicht werden kann (so viel auf unser Vermögen ankommt) und daher lediglich zum Gegenstande der Hoffnung gemacht wird. Diesem ungeachtet ist das christliche Princip der Moral selbst doch nicht theologisch (mithin Heteronomie), sondern Autonomie der reinen praktischen Vernunft für sich selbst, weil sie die Erkenntniß Gottes und seines Willens nicht zum Grunde dieser Gesetze, sondern nur der Gelangung zum höchsten Gute unter der Bedingung der Befolgung derselben macht und selbst die eigentliche Triebfeder zu Befolgung der ersteren nicht in den gewünschten Folgen derselben, sondern in der Vorstellung der Pflicht allein setzt, als in deren treuer Beobachtung die Würdigkeit des Erwerbs der letztern allein besteht.",
7.324,Von dem erlaubten moralischen Schein.,
6.398,"Von der Eintheilung der Moral, als eines Systems der Pflichten überhaupt.",
6.6,"Moral also führt unumgänglich zur Religion, wodurch sie sich zur Idee eines machthabenden moralischen Gesetzgebers außer dem Menschen erweitert *) , in dessen Willen dasjenige Endzweck (der Weltschöpfung) ist, was zugleich der Endzweck des Menschen sein kann und soll.",
8.629,"Was ist Philosophie, als Lehre, die unter allen Wissenschaften das größte Bedürfniß der Menschen ausmacht?",
6.381,Das angeborne Recht ist nur ein einziges.,
2.599,"Der erste Theil, welcher dogmatisch ist.",
7.694,Von dem höchsten moralisch=physischen Gut.,
2.570,§ 2. Die ersten Gründe der Moral sind nach ihrer gegenwärtigen Beschaffenheit noch nicht aller erforderlichen Evidenz fähig.,
9.2419,"Um in den Kindern einen moralischen Charakter zu begründen, müssen wir folgendes merken:",
8.656,"Es ist also ein heiliges, unbedingt gebietendes, durch keine Convenienzen einzuschränkendes Vernunftgebot: in allen Erklärungen wahrhaft (ehrlich) zu sein.",
6.317,Verbindlichkeit ist die Nothwendigkeit einer freien Handlung unter einem kategorischen Imperativ der Vernunft.,
5.81,Praktische materiale Bestimmungsgründe im Princip der Sittlichkeit sind,
1.470,Folgende Anmerkung legt ein ganz unbekanntes dynamisches Gesetz dar und ist in der Kräftenschätzung von nicht gemeiner Erheblichkeit.,
4.1066,Wie ist ein kategorischer Imperativ möglich?,
4.989,"Der kategorische Imperativ ist also nur ein einziger und zwar dieser: handle nur nach derjenigen Maxime, durch die du zugleich wollen kannst, daß sie ein allgemeines Gesetz werde.",
6.119,"Ein rechtlich-bürgerlicher (politischer) Zustand ist das Verhältniß der Menschen untereinander, so fern sie gemeinschaftlich unter öffentlichen Rechtsgesetzen (die insgesammt Zwangsgesetze sind) stehen. Ein ethisch-bürgerlicher Zustand ist der, da sie unter dergleichen zwangsfreien, d. i. bloßen Tugendgesetzen vereinigt sind.",
6.883,3) Tugend muß (gleich der Klugheit) der Erfahrung abgelernt werden.,
6.1127,Von den die Pflicht der Achtung für andere Menschen verletzenden Lastern.,
6.937,"Die, wenn gleich nicht vornehmste, doch erste Pflicht des Menschen gegen sich selbst in der Qualität seiner Thierheit ist die Selbsterhaltung in seiner animalischen Natur.",
4.1051,Freiheit muß als Eigenschaft des Willens aller vernünftigen Wesen vorausgesetzt werden.,
2.110,2. Vernünftig ist ein Merkmal der menschlichen Seele;,
5.639,Eine Naturschönheit ist ein schönes Ding; die Kunstschönheit ist eine schöne Vorstellung von einem Dinge.,
4.512,"Dasjenige Ding, dessen Handlung niemals als die Concurrenz vieler handelnden Dinge angesehen werden kann, ist einfach. Nun ist die Seele oder das denkende Ich ein solches: Also etc..",
9.166,"3) die ästhetische Wahrheit. Eine bloß subjective Wahrheit, die nur in der Übereinstimmung des Erkenntnisses mit dem Subject und den Gesetzen des Sinnen-Scheines besteht und folglich nichts weiter als ein allgemeiner Schein ist;",
2.111,3. Ein Geist sein ist ein Merkmal der menschlichen Seele; denn die Vergleichung eines entfernten Merkmals mit der Sache selbst ist nicht anders wie durch diese drei Handlungen möglich.,
5.791,"Dieses Princip, zugleich die Definition derselben, heißt: ein organisirtes Product der Natur ist das, in welchem alles Zweck und wechselseitig auch Mittel ist. Nichts in ihm ist umsonst, zwecklos, oder einem blinden Naturmechanism zuzuschreiben.",
4.1214,Die Möglichkeit der Materie erfordert eine Anziehungskraft als die zweite wesentliche Grundkraft derselben.,
1.479,"Wir sind in dem Mittelpunkte der artigsten Aufgaben, welche die abstracte Mechanik vorher niemals hat gewähren können.",
3.694,"Es ist keine Freiheit, sondern alles in der Welt geschieht lediglich nach Gesetzen der Natur.",
4.1167,"Die Materie erfüllt einen Raum, nicht durch ihre bloße Existenz, sondern durch eine besondere bewegende Kraft.",
3.289,Das Schema der Wirklichkeit ist das Dasein in einer bestimmten Zeit.,
4.239,Das Schema der Wirklichkeit ist das Dasein in einer bestimmten Zeit.,
1.112,"Demnach ist die in der Bewegung aufgewandte Zeit der wahre und einzige Charakter der lebendigen Kraft; und sie allein ist es, wodurch diese ein besonderes Ma vor der todten erhält.",
9.1706,"Der Mensch sollte unter diesen billig die erste Classe einnehmen, aber seine Vernunft erhebt ihn über die Thiergattungen zu weit.",
1.126,"Es ist also erstens die Abwesenheit der Wirklichkeit der Bewegung nicht die wahre und rechte Bedingung, welche der Kraft eines Körpers die Schätzung der schlechten Geschwindigkeit zueignet.",
3.903,Es sind nur drei Beweisarten vom Dasein Gottes aus speculativer Vernunft möglich.,
9.640,"Das Princip, worauf die Möglichkeit und Gültigkeit aller kategorischen Vernunftschlüsse beruht, ist dieses:",
4.1035,Die Autonomie des Willens als oberstes Princip der Sittlichkeit.,
6.1077,"Es fällt nicht von selbst in die Augen: daß ein solches Gesetz überhaupt in der Vernunft liege; vielmehr scheint die Maxime: ""Ein jeder für sich, Gott (das Schicksal) für uns alle,"" die natürlichste zu sein.",
8.564,"Nach einer solchen Abstraction von allem Empirischen, was der Begriff des Staats- und Völkerrechts enthält (dergleichen das Bösartige der menschlichen Natur ist, welches den Zwang nothwendig macht), kann man folgenden Satz die transscendentale Formel des öffentlichen Rechts nennen:",
8.405,"Der bürgerliche Zustand also, bloß als rechtlicher Zustand betrachtet, ist auf folgende Principien a priori gegründet:",
3.1204,"Ich verstehe unter einer Architektonik die Kunst der Systeme. Weil die systematische Einheit dasjenige ist, was gemeine Erkenntniß allererst zur Wissenschaft, d. i. aus einem bloßen Aggregat derselben ein System, macht, so ist Architektonik die Lehre des Scientifischen in unserer Erkenntniß überhaupt, und sie gehört also nothwendig zur Methodenlehre.",
5.847,§ 75. Der Begriff einer objectiven Zweckmäßigkeit der Natur ist ein kritisches Princip der Vernunft für die reflectirende Urtheilskraft.,
9.236,"Die erstere Schlußart, nach welcher die Folge nur ein negativ und indirect zureichendes Kriterium der Wahrheit eines Erkenntnisses sein kann, heißt in der Logik die apagogische ( modus tollens ).",
4.1047,Der Begriff der Freiheit ist der Schlüssel zur Erklärung der Autonomie des Willens.,
7.590,Der Geschmack enthält eine Tendenz zur äußeren Beförderung der Moralität.,
7.242,"Allen Versuchen aber, zu einer solchen Wissenschaft mit Gründlichkeit zu gelangen, stehen erhebliche, der menschlichen Natur selber anhängende Schwierigkeiten entgegen.",
8.464,"Es ist ein vornehmlich in der frommen Sprache üblicher Ausdruck, einen sterbenden Menschen sprechen zu lassen: er gehe aus der Zeit in die Ewigkeit.",
9.612,"Das allgemeine Princip, worauf die Gültigkeit alles Schließens durch die Vernunft beruht, läßt sich in folgender Formel bestimmt ausdrücken:",
9.311,Der erste Grad der Erkenntniß ist: sich etwas vorstellen;,
