ID,Absatz,"Wollen, Absicht, Handlung"
9.324,"1) Meinen. Das Meinen oder das Fürwahrhalten aus einem Erkenntnißgrunde, der weder subjectiv noch objectiv hinreichend ist, kann als ein vorläufiges Urtheilen ( sub conditione suspensiva ad interim ) angesehen werden, dessen man nicht leicht entbehren kann. Man muß erst meinen, ehe man annimmt und behauptet, sich dabei aber auch hüten, eine Meinung für etwas mehr als bloße Meinung zu halten. Vom Meinen fangen wir größtenteils bei allem unserm Erkennen an. Zuweilen haben wir ein dunkles Vorgefühl von der Wahrheit, eine Sache scheint uns Merkmale der Wahrheit zu enthalten; wir ahnen ihre Wahrheit schon, noch ehe wir sie mit bestimmter Gewißheit erkennen.",
5.37,Folgerung.,
5.62,Folgerung.,
8.416,Folgerung.,
6.322,"That heißt eine Handlung, sofern sie unter Gesetzen der Verbindlichkeit steht, folglich auch sofern das Subject in derselben nach der Freiheit seiner Willkür betrachtet wird. Der Handelnde wird durch einen solchen Act als Urheber der Wirkung betrachtet, und diese zusammt der Handlung selbst können ihm zugerechnet werden, wenn man vorher das Gesetz kennt, kraft welches auf ihnen eine Verbindlichkeit ruht.",
6.864,b. Vom Gewissen.,
9.2415,"Das letzte ist die Gründung des Charakters. Dieser besteht in dem festen Vorsatze, etwas thun zu wollen, und dann auch in der wirklichen Ausübung desselben. Vir propositi tenax , sagt Horaz, und das ist ein guter Charakter! z. E. wenn ich Jemanden etwas versprochen habe, so muß ich es auch halten, gesetzt gleich, daß es mir Schaden brächte. Denn ein Mann, der sich etwas vorsetzt, es aber nicht thut, kann sich selbst nicht mehr trauen, z. E. wenn Jemand es sich vornimmt, immer frühe aufzustehn, um zu studiren, oder dies oder jenes zu thun, oder um einen Spaziergang zu machen, und sich im Frühlinge nun damit entschuldigt, daß es noch des Morgens zu kalt sei, und es ihm schaden könne; im Sommer aber, daß es sich so gut schlafen lasse, und der Schlaf ihm angenehm sei, und so seinen Vorsatz immer von einem Tage zum andern verschiebt: so traut er sich am Ende selbst nicht mehr.",
9.326,"2) Glauben. Das Glauben oder das Fürwahrhalten aus einem Grunde, der zwar objectiv unzureichend, aber subjectiv zureichend ist, bezieht sich auf Gegenstände, in Ansehung deren man nicht allein nichts wissen, sondern auch nichts meinen, ja auch nicht einmal Wahrscheinlichkeit vorwenden, sondern bloß gewiß sein kann, daß es nicht widersprechend ist, sich dergleichen Gegenstände so zu denken, wie man sie sich denkt. Das Übrige hierbei ist ein freies Fürwahrhalten, welches nur in praktischer, a priori gegebener Absicht nöthig ist, also ein Fürwahrhalten dessen, was ich aus moralischen Gründen annehme und zwar so, daß ich gewiß bin, das Gegentheil könne nie bewiesen werden. *)",
5.354,"Gut ist das, was vermittelst der Vernunft durch den bloßen Begriff gefällt. Wir nennen einiges wozu gut (das Nützliche), was nur als Mittel gefällt; ein anderes aber an sich gut, was für sich selbst gefällt. In beiden ist immer der Begriff eines Zwecks, mithin das Verhältniß der Vernunft zum (wenigstens möglichen) Wollen, folglich ein Wohlgefallen am Dasein eines Objects oder einer Handlung, d. i. irgend ein Interesse, enthalten.",
5.279,"Der Wille, als Begehrungsvermögen, ist nämlich eine von den mancherlei Naturursachen in der Welt, nämlich diejenige, welche nach Begriffen wirkt; und Alles, was als durch einen Willen möglich (oder nothwendig) vorgestellt wird, heißt praktisch-möglich (oder nothwendig): zum Unterschiede von der physischen Möglichkeit oder Nothwendigkeit einer Wirkung, wozu die Ursache nicht durch Begriffe (sondern wie bei der leblosen Materie durch Mechanism und bei Thieren durch Instinct) zur Causalität bestimmt wird. - Hier wird nun in Ansehung des Praktischen unbestimmt gelassen: ob der Begriff, der der Causalität des Willens die Regel giebt, ein Naturbegriff, oder ein Freiheitsbegriff sei.",
7.724,II. Temperamente der Thätigkeit.,
9.704,III . Schlüsse der Urtheilskraft.,
9.741,§. 94. Manier und Methode.,
7.543,1) Selbst denken.,
6.1138,C. Die Verhöhnung.,
9.2072,Cochin=China.,
9.1791,d . Der Hammerfisch,
7.619,Von den Affecten insbesondere.,
9.1975,"3. Kupfer,",
9.272,"Erstlich, als Vorstellung an sich selbst;",
9.2051,Sitten und Charakter der Nation.,
6.95,c) Schwierigkeiten gegen die Realität dieser Idee und Auflösung derselben.,
6.840,"2. Fremde Glückseligkeit als Zweck, der zugleich Pflicht ist.",
4.1133,Grundsatz.,
6.1053,"Erstes Hauptstück. Von den Pflichten gegen Andere, blos als Menschen.",
9.792,"2) als ein Begriff, deutlich sei,",
9.604,In Absicht auf die Contraposition gilt die allgemeine Regel:,
6.618,Des öffentlichen Rechts,
6.688,Des öffentlichen Rechts,
4.890,"Nur zwei Dinge muß ich im Fall, daß die Ausforderung angenommen wird, verbitten: erstlich das Spielwerk von Wahrscheinlichkeit und Muthmaßung, welches der Metaphysik eben so schlecht ansteht als der Geometrie; zweitens die Entscheidung vermittelst der Wünschelruthe des so genannten gesunden Menschenverstandes, die nicht jedermann schlägt, sondern sich nach persönlichen Eigenschaften richtet.",
9.2320,"Sie besteht demnach 1) aus der scholastisch-mechanischen Bildung in Ansehung der Geschicklichkeit, ist also didaktisch (Informator), 2) aus der pragmatischen in Ansehung der Klugheit (Hofmeister), 3) aus der moralischen in Ansehung der Sittlichkeit.",
5.74,"Die Maxime der Selbstliebe (Klugheit) räth blos an; das Gesetz der Sittlichkeit gebietet. Es ist aber doch ein großer Unterschied zwischen dem, wozu man uns anräthig ist, und dem, wozu wir verbindlich sind.",
2.146,§ 6. Schlußbetrachtung.,
3.638,"Die Fragen, welche bei einer solchen Dialektik der reinen Vernunft sich natürlich darbieten, sind also: 1. Bei welchen Sätzen denn eigentlich die reine Vernunft einer Antinomie unausbleiblich unterworfen sei. 2. Auf welchen Ursachen diese Antinomie beruhe. 3. Ob und auf welche Art dennoch der Vernunft unter diesem Widerspruch ein Weg zur Gewißheit offen bleibe.",
9.353,"Die Zurückhaltung des Urtheils kann in zwiefacher Absicht geschehen: entweder, um die Gründe des bestimmenden Urtheils aufzusuchen, oder um niemals zu urtheilen. Im erstern Falle heißt die Aufschiebung des Urtheils eine kritische ( suspensio judicii indagatoria ), im letztern eine skeptische ( suspensio judicii sceptica ). Denn der Skeptiker thut auf alles Urtheilen Verzicht, der wahre Philosoph dagegen suspendirt bloß sein Urtheil, wofern er noch nicht genugsame Gründe hat, etwas für wahr zu halten.",
4.989,"Der kategorische Imperativ ist also nur ein einziger und zwar dieser: handle nur nach derjenigen Maxime, durch die du zugleich wollen kannst, daß sie ein allgemeines Gesetz werde.",
9.649,"4) Die Conclusion richtet sich allemal nach dem schwächern Theile des Schlusses; d. h. nach dem verneinenden und besondern Satze in den Prämissen, als welcher der schwächere Theil des kategorischen Vernunftschlusses genannt wird ( conclusio sequitur partem debiliorem ). Ist daher",
1.942,SECTIO I. De principio contradictionis.,
9.2299,"2) Muß der Mensch cultivirt werden. Cultur begreift unter sich die Belehrung und die Unterweisung. Sie ist die Verschaffung der Geschicklichkeit. Diese ist der Besitz eines Vermögens, welches zu allen beliebigen Zwecken zureichend ist. Sie bestimmt also gar keine Zwecke, sondern überläßt das nachher den Umständen.",
6.835,"1. Eigene Vollkommenheit als Zweck, der zugleich Pflicht ist.",
6.1094,C. Theilnehmende Empfindung ist überhaupt Pflicht.,
7.614,"Die durch die Vernunft des Subjects schwer oder gar nicht bezwingliche Neigung ist Leidenschaft. Dagegen ist das Gefühl einer Lust oder Unlust im gegenwärtigen Zustande, welches im Subject die Überlegung (die Vernunftvorstellung, ob man sich ihm überlassen oder weigern solle) nicht aufkommen läßt, der Affect.",
7.310,"Die Leichtigkeit etwas zu thun ( promptitudo ) muß mit der Fertigkeit in solchen Handlungen ( habitus ) nicht verwechselt werden. Die erstere bedeutet einen gewissen Grad des mechanischen Vermögens: ""ich kann, wenn ich will,"" und bezeichnet subjective Möglichkeit; die zweite die subjectiv-praktische Nothwendigkeit, d. i. Gewohnheit, mithin einen gewissen Grad des Willens, der durch den oft wiederholten Gebrauch seines Vermögens erworben wird: ""ich will, weil es die Pflicht gebietet."" Daher kann man die Tugend nicht so erklären: sie sei die Fertigkeit in freien rechtmäßigen Handlungen; denn da wäre sie blos Mechanism der Kraftanwendung; sondern Tugend ist die moralische Stärke in Befolgung seiner Pflicht, die niemals zur Gewohnheit werden, sondern immer ganz neu und ursprünglich aus der Denkungsart hervorgehen soll.",
5.585,"Das Wohlgefallen an einer Handlung um ihrer moralischen Beschaffenheit willen ist dagegen keine Lust des Genusses, sondern der Selbstthätigkeit und deren Gemäßheit mit der Idee seiner Bestimmung. Dieses Gefühl, welches das sittliche heißt, erfordert aber Begriffe und stellt keine freie, sondern gesetzliche Zweckmäßigkeit dar, läßt sich also auch nicht anders als vermittelst der Vernunft und, soll die Lust bei jedermann gleichartig sein, durch sehr bestimmte praktische Vernunftbegriffe allgemein mittheilen.",
6.891,"Fertigkeit ( habitus ) ist eine Leichtigkeit zu handeln und eine subjective Vollkommenheit der Willkür. - Nicht jede solche Leichtigkeit aber ist eine freie Fertigkeit ( habitus libertatis ); denn wenn sie Angewohnheit ( assuetudo ), d. i. durch öfters wiederholte Handlung zur Nothwendigkeit gewordene Gleichförmigkeit, derselben ist, so ist sie keine aus der Freiheit hervorgehende, mithin auch nicht moralische Fertigkeit. Die Tugend kann man also nicht durch die Fertigkeit in freien gesetzmäßigen Handlungen definiren; wohl aber, wenn hinzugesetzt würde, ""sich durch die Vorstellung des Gesetzes im Handeln zu bestimmen"", und da ist diese Fertigkeit eine Beschaffenheit nicht der Willkür, sondern des Willens, der ein mit der Regel, die er annimmt, zugleich allgemein-gesetzgebendes Begehrungsvermögen ist, und eine solche allein kann zur Tugend gezählt werden.",
6.325,"Recht oder unrecht ( rectum aut minus rectum ) überhaupt ist eine That, sofern sie pflichtmäßig oder pflichtwidrig ( factum licitum aut illicitum ) ist; die Pflicht selbst mag ihrem Inhalte oder ihrem Ursprunge nach sein, von welcher Art sie wolle. Eine pflichtwidrige That heißt Übertretung ( reatus ).",
8.342,"I. Das schlechthin Zweckwidrige, was weder als Zweck, noch als Mittel von einer Weisheit gebilligt und begehrt werden kann.",
6.861,"Dieses ist die Empfänglichkeit für Lust oder Unlust blos aus dem Bewußtsein der Übereinstimmung oder des Widerstreits unserer Handlung mit dem Pflichtgesetze. Alle Bestimmung der Willkür aber geht von der Vorstellung der möglichen Handlung durch das Gefühl der Lust oder Unlust, an ihr oder ihrer Wirkung ein Interesse zu nehmen, zur That; wo der ästhetische Zustand (der Afficirung des inneren Sinnes) nun entweder ein pathologisches oder moralisches Gefühl ist. - Das erstere ist dasjenige Gefühl, welches vor der Vorstellung des Gesetzes vorhergeht, das letztere das, was nur auf diese folgen kann.",
5.54,"Vorausgesetzt, daß ein Wille frei sei, das Gesetz zu finden, welches ihn allein nothwendig zu bestimmen tauglich ist.",
3.1192,"Es kann aber überall bloß in praktischer Beziehung das theoretisch unzureichende Fürwahrhalten Glauben genannt werden. Diese praktische Absicht ist nun entweder die der Geschicklichkeit, oder der Sittlichkeit, die erste zu beliebigen und zufälligen, die zweite aber zu schlechthin nothwendigen Zwecken.",
4.1003,"Der Wille wird als ein Vermögen gedacht, der Vorstellung gewisser Gesetze gemäß sich selbst zum Handeln zu bestimmen. Und ein solches Vermögen kann nur in vernünftigen Wesen anzutreffen sein. Nun ist das, was dem Willen zum objectiven Grunde seiner Selbstbestimmung dient, der Zweck, und dieser, wenn er durch bloße Vernunft gegeben wird, muß für alle vernünftige Wesen gleich gelten. Was dagegen bloß den Grund der Möglichkeit der Handlung enthält, deren Wirkung Zweck ist, heißt das Mittel. Der subjective Grund des Begehrens ist die Triebfeder, der objective des Wollens der Bewegungsgrund; daher der Unterschied zwischen subjectiven Zwecken, die auf Triebfedern beruhen, und objectiven, die auf Bewegungsgründe ankommen, welche für jedes vernünftige Wesen gelten. Praktische Principien sind formal, wenn sie von allen subjectiven Zwecken abstrahiren; sie sind aber material, wenn sie diese, mithin gewisse Triebfedern zum Grunde legen. Die Zwecke, die sich ein vernünftiges Wesen als Wirkungen seiner Handlung nach Belieben vorsetzt, (materiale Zwecke) sind insgesammt nur relativ; denn nur bloß ihr Verhältniß auf ein besonders geartetes Begehrungsvermögen des Subjects giebt ihnen den Werth, der daher keine allgemeine für alle vernünftige Wesen und auch nicht für jedes Wollen gültige und nothwendige Principien, d. i. praktische Gesetze, an die Hand geben kann. Daher sind alle diese relative Zwecke nur der Grund von hypothetischen Imperativen.",
7.267,Von dem willkürlichen Bewußtsein seiner Vorstellungen.,
6.410,"Es ist möglich, einen jeden äußern Gegenstand meiner Willkür als das Meine zu haben; d. i.: eine Maxime, nach welcher, wenn sie Gesetz würde, ein Gegenstand der Willkür an sich (objectiv) herrenlos ( res nullius ) werden müßte, ist rechtswidrig.",
8.203,"Zweitens wird die Freiheit zu denken auch in der Bedeutung genommen, daß ihr der Gewissenszwang entgegengesetzt ist; wo ohne alle äußere Gewalt in Sachen der Religion sich Bürger über andere zu Vormündern aufwerfen und statt Argument durch vorgeschriebene, mit ängstlicher Furcht vor der Gefahr einer eigenen Untersuchung begleitete Glaubensformeln alle Prüfung der Vernunft durch frühen Eindruck auf die Gemüther zu verbannen wissen.",
5.147,"Das Bewußtsein einer freien Unterwerfung des Willens unter das Gesetz doch als mit einem unvermeidlichen Zwange, der allen Neigungen, aber nur durch eigene Vernunft angethan wird, verbunden, ist nun die Achtung fürs Gesetz. Das Gesetz, was diese Achtung fordert und auch einflößt, ist, wie man sieht, kein anderes als das moralische (denn kein anderes schließt alle Neigungen von der Unmittelbarkeit ihres Einflusses auf den Willen aus). Die Handlung, die nach diesem Gesetze mit Ausschließung aller Bestimmungsgründe aus Neigung objectiv praktisch ist, heißt Pflicht, welche um dieser Ausschließung willen in ihrem Begriffe praktische Nöthigung, d. i. Bestimmung zu Handlungen, so ungerne, wie sie auch geschehen mögen, enthält. Das Gefühl, das aus dem Bewußtsein dieser Nöthigung entspringt, ist nicht pathologisch, als ein solches, was von einem Gegenstande der Sinne gewirkt würde, sondern allein praktisch, d. i. durch eine vorhergehende (objective) Willensbestimmung und Causalität der Vernunft, möglich. Es enthält also, als Unterwerfung unter ein Gesetz, d. i. als Gebot (welches für das sinnlich afficirte Subject Zwang ankündigt), keine Lust, sondern so fern vielmehr Unlust an der Handlung in sich. Dagegen aber, da dieser Zwang blos durch Gesetzgebung der eigenen Vernunft ausgeübt wird, enthält es auch Erhebung, und die subjective Wirkung aufs Gefühl, so fern davon reine praktische Vernunft die alleinige Ursache ist, kann also blos Selbstbilligung in Ansehung der letzteren heißen, indem man sich dazu ohne alles Interesse blos durchs Gesetz bestimmt erkennt und sich nunmehr eines ganz anderen, dadurch subjectiv hervorgebrachten Interesse, welches rein praktisch und frei ist, bewußt wird, welches an einer pflichtmäßigen Handlung zu nehmen, nicht etwa eine Neigung anräthig ist, sondern die Vernunft durchs praktische Gesetz schlechthin gebietet und auch wirklich hervorbringt, darum aber einen ganz eigenthümlichen Namen, nämlich den der Achtung, führt.",
6.730,"Wenn jemand nicht beweisen kann, daß ein Ding ist, so mag er versuchen zu beweisen, daß es nicht ist. Will es ihm mit keinem von beiden gelingen (ein Fall, der oft eintritt), so kann er noch fragen: ob es ihn interessire, das Eine oder das Andere (durch eine Hypothese) anzunehmen, und dies zwar entweder in theoretischer, oder in praktischer Rücksicht, d. i. entweder um sich bloß ein gewisses Phänomen (wie z. B. für den Astronom das des Rückganges und Stillstandes der Planeten) zu erklären, oder um einen gewissen Zweck zu erreichen, der nun wiederum entweder pragmatisch (bloßer Kunstzweck) oder moralisch, d. i. ein solcher Zweck sein kann, den sich zu setzen die Maxime selbst Pflicht ist. - Es versteht sich von selbst: daß nicht das Annehmen ( suppositio ) der Ausführbarkeit jenes Zwecks, welches ein bloß theoretisches und dazu noch problematisches Urtheil ist, hier zur Pflicht gemacht werde, denn dazu (etwas zu glauben) giebts keine Verbindlichkeit; sondern das Handeln nach der Idee jenes Zwecks, wenn auch nicht die mindeste theoretische Wahrscheinlichkeit da ist, daß er ausgeführt werden könne, dennoch aber seine Unmöglichkeit gleichfalls nicht demonstrirt werden kann, das ist es, wozu uns eine Pflicht obliegt.",
8.395,"Allerdings muß der Wille Motive haben; aber diese sind nicht gewisse vorgesetzte, aufs physische Gefühl bezogene Objecte als Zwecke, sondern nichts als das unbedingte Gesetz selbst, für welches die Empfänglichkeit des Willens, sich unter ihm als unbedingter Nöthigung zu befinden, das moralische Gefühl heißt; welches also nicht Ursache, sondern Wirkung der Willensbestimmung ist, von welchem wir nicht die mindeste Wahrnehmung in uns haben würden, wenn jene Nöthigung in uns nicht vorherginge. Daher das alte Lied: daß dieses Gefühl, mithin eine Lust, die wir uns zum Zwecke machen, die erste Ursache der Willensbestimmung, folglich die Glückseligkeit (wozu jene als Element gehöre) doch den Grund aller objectiven Nothwendigkeit zu handeln, folglich aller Verpflichtung ausmache, unter die vernünftelnden Tändeleien gehört. Kann man nämlich bei Anführung einer Ursache zu einer gewissen Wirkung nicht aufhören zu fragen, so macht man endlich die Wirkung zur Ursache von sich selbst.",
6.320,"Pflicht ist diejenige Handlung, zu welcher jemand verbunden ist. Sie ist also die Materie der Verbindlichkeit, und es kann einerlei Pflicht (der Handlung nach) sein, ob wir zwar auf verschiedene Art dazu verbunden werden können.",
2.288,"1. Ordnung und Anständigkeit, wenn sie gleich nothwendig ist, bezeichnet einen verständigen Urheber.",
5.59,"Handle so, daß die Maxime deines Willens jederzeit zugleich als Princip einer allgemeinen Gesetzgebung gelten könne.",
6.781,Vorrede.,
2.370,Vorrede.,
6.273,Vorrede.,
2.155,Vorrede.,
7.4,Vorrede.,
9.2,Vorrede.,
7.237,Vorrede.,
6.819,"Wenn von der dem Menschen überhaupt (eigentlich der Menschheit) zugehörigen Vollkommenheit gesagt wird: daß, sie sich zum Zweck zu machen, an sich selbst Pflicht sei, so muß sie in demjenigen gesetzt werden, was Wirkung von seiner That sein kann, nicht was blos Geschenk ist, das er der Natur verdanken muß; denn sonst wäre sie nicht Pflicht. Sie kann also nichts anders sein als Cultur seines Vermögens (oder der Naturanlage), in welchem der Verstand als Vermögen der Begriffe, mithin auch deren, die auf Pflicht gehen, das oberste ist, zugleich aber auch seines Willens (sittlicher Denkungsart) aller Pflicht überhaupt ein Gnüge zu thun. 1) Es ist ihm Pflicht: sich aus der Rohigkeit seiner Natur, aus der Thierheit ( quoad actum ), immer mehr zur Menschheit, durch die er allein fähig ist sich Zwecke zu setzen, empor zu arbeiten: seine Unwissenheit durch Belehrung zu ergänzen und seine Irrthümer zu verbessern, und dieses ist ihm nicht blos die technisch-praktische Vernunft zu seinen anderweitigen Absichten (der Kunst) anräthig, sondern die moralisch-praktische gebietet es ihm schlechthin und macht diesen Zweck ihm zur Pflicht, um der Menschheit, die in ihm wohnt, würdig zu sein. 2) Die Cultur seines Willens bis zur reinsten Tugendgesinnung, da nämlich das Gesetz zugleich die Triebfeder seiner pflichtmäßigen Handlungen wird, zu erheben und ihm aus Pflicht zu gehorchen, welches innere moralisch-praktische Vollkommenheit ist, die, weil es ein Gefühl der Wirkung ist, welche der in ihm selbst gesetzgebende Wille auf das Vermögen ausübt darnach zu handeln, das moralische Gefühl, gleichsam ein besonderer Sinn ( sensus moralis ), ist, der zwar freilich oft schwärmerisch, als ob er (gleich dem Genius des Sokrates) vor der Vernunft vorhergehe, oder auch ihr Urtheil gar entbehren könne, mißbraucht wird, doch aber eine sittliche Vollkommenheit ist, jeden besonderen Zweck, der zugleich Pflicht ist, sich zum Gegenstande zu machen.",
9.2457,"Darauf, daß man vieles immer wie Pflicht ansieht. Eine Handlung muß mir werth sein, nicht weil sie mit meiner Neigung stimmt, sondern weil ich dadurch meine Pflicht erfülle.",
6.125,"Hier haben wir nun eine Pflicht von ihrer eignen Art nicht der Menschen gegen Menschen, sondern des menschlichen Geschlechts gegen sich selbst. Jede Gattung vernünftiger Wesen ist nämlich objectiv, in der Idee der Vernunft, zu einem gemeinschaftlichen Zwecke, nämlich der Beförderung des höchsten als eines gemeinschaftlichen Guts, bestimmt. Weil aber das höchste sittliche Gut durch die Bestrebung der einzelnen Person zu ihrer eigenen moralischen Vollkommenheit allein nicht bewirkt wird, sondern eine Vereinigung derselben in ein Ganzes zu eben demselben Zwecke zu einem System wohlgesinnter Menschen erfordert, in welchem und durch dessen Einheit es allein zu Stande kommen kann, die Idee aber von einem solchen Ganzen, als einer allgemeinen Republik nach Tugendgesetzen, eine von allen moralischen Gesetzen (die das betreffen, wovon wir wissen, daß es in unserer Gewalt stehe) ganz unterschiedene Idee ist, nämlich auf ein Ganzes hinzuwirken, wovon wir nicht wissen können, ob es als ein solches auch in unserer Gewalt stehe: so ist die Pflicht der Art und dem Princip nach von allen andern unterschieden. - Man wird schon zum voraus vermuthen, daß diese Pflicht der Voraussetzung einer andern Idee, nämlich der eines höhern moralischen Wesens, bedürfen werde, durch dessen allgemeine Veranstaltung die für sich unzulänglichen Kräfte der Einzelnen zu einer gemeinsamen Wirkung vereinigt werden. Allein wir müssen allererst dem Leitfaden jenes sittlichen Bedürfnisses überhaupt nachgehen und sehen, worauf uns dieses führen werde.",
1.636,"Allein laßt uns sehen, wie diese Gründe, die man in den Händen der Gegner als schädlich befürchtet, vielmehr kräftige Waffen sind, sie zu bestreiten. Die nach ihren allgemeinsten Gesetzen sich bestimmende Materie bringt durch ihr natürliches Betragen, oder, wenn man es so nennen will, durch eine blinde Mechanik anständige Folgen hervor, die der Entwurf einer höchsten Weisheit zu sein scheinen. Luft, Wasser, Wärme erzeugen, wenn man sie sich selbst überlassen betrachtet, Winde und Wolken, Regen, Ströme, welche die Länder befeuchten, und alle die nützliche Folgen, ohne welche die Natur traurig, öde und unfruchtbar bleiben müßte. Sie bringen aber diese Folgen nicht durch ein bloßes Ungefähr, oder durch einen Zufall, der eben so leicht nachtheilig hätte ausfallen können, hervor, sondern man sieht: daß sie durch ihre natürliche Gesetze eingeschränkt sind auf keine andere als diese Weise zu wirken. Was soll man von dieser Übereinstimmung denn gedenken? Wie wäre es wohl möglich, daß Dinge von verschiedenen Naturen in Verbindung mit einander so vortreffliche Übereinstimmungen und Schönheiten zu bewirken trachten sollten, sogar zu Zwecken solcher Dinge, die sich gewissermaßen außer dem Umfange der todten Materie befinden, nämlich zum Nutzen der Menschen und Thiere, wenn sie nicht einen gemeinschaftlichen Ursprung erkennten, nämlich einen unendlichen Verstand, in welchem aller Dinge wesentliche Beschaffenheiten beziehend entworfen worden? Wenn ihre Naturen für sich und unabhängig nothwendig wären, was für ein erstaunliches Ungefähr, oder vielmehr was für eine Unmöglichkeit würde es nicht sein, daß sie mit ihren natürlichen Bestrebungen sich gerade so zusammen passen sollten, als eine überlegte kluge Wahl sie hätte vereinbaren können.",
2.294,"1. Die Ursache selbst der vortheilhaftesten Verfassungen in solchen allgemeinen Gesetzen, die mit einer nothwendigen Einheit außer andern anständigen Folgen auch auf die Hervorbringung dieser Wirkungen in Beziehung stehen.",
6.81,"Natürliche Neigungen sind, an sich selbst betrachtet, gut, d. i. unverwerflich, und es ist nicht allein vergeblich, sondern es wäre auch schädlich und tadelhaft, sie ausrotten zu wollen; man muß sie vielmehr nur bezähmen, damit sie sich untereinander nicht selbst aufreiben, sondern zur Zusammenstimmung in einem Ganzen, Glückseligkeit genannt, gebracht werden können. Die Vernunft aber, die dieses ausrichtet, heißt Klugheit. Nur das Moralisch-Gesetzwidrige ist an sich selbst böse, schlechterdings verwerflich, und muß ausgerottet werden; die Vernunft aber, die das lehrt, noch mehr aber, wenn sie es auch ins Werk richtet, verdient allein den Namen der Weisheit, in Vergleichung mit welcher das Laster zwar auch Thorheit genannt werden kann, aber nur alsdann, wenn die Vernunft gnugsam Stärke in sich fühlt, um es (und alle Anreize dazu) zu verachten, und nicht bloß als ein zu fürchtendes Wesen zu hassen, und sich dagegen zu bewaffnen.",
5.45,"Wenn ein vernünftiges Wesen sich seine Maximen als praktische allgemeine Gesetze denken soll, so kann es sich dieselbe nur als solche Principien denken, die nicht der Materie, sondern blos der Form nach den Bestimmungsgrund des Willens enthalten.",
