1.442,"Allein dieses sind auch die Bedingungen, die diesem Gesetze anhängen.",
9.526,"2. In problematischen Urtheilen, die man auch für solche erklären kann, deren Materie gegeben ist mit dem möglichen Verhältniß zwischen Prädicat und Subject, muß das Subject jederzeit eine kleinere Sphäre haben als das Prädicat.",
9.723,"In der Reihe zusammengesetzter Schlüsse kann man auf eine doppelte Art, entweder von den Gründen herab zu den Folgen, oder von den Folgen herauf zu den Gründen schließen. Das erste geschieht durch Episyllogismen, das andre durch Prosyllogismen.",
9.696,Das Princip der disjunctiven Vernunftschlüsse ist der Grundsatz des ausschließenden Dritten:,
6.169,Zweite Abtheilung. Historische Vorstellung der allmähligen Gründung der Herrschaft des guten Princips auf Erden.,
5.363,Aus dem ersten Momente gefolgerte Erklärung des Schönen.,
5.887,§ 80. Von der nothwendigen Unterordnung des Princips des Mechanisms unter dem teleologischen in Erklärung eines Dinges als Naturzwecks.,
9.109,"Die Erkenntniß des Allgemeinen in abstracto ist speculative Erkenntniß, die Erkenntniß des Allgemeinen in concreto gemeine Erkenntniß. Philosophische Erkenntniß ist speculative Erkenntniß der Vernunft und sie fängt also da an, wo der gemeine Vernunftgebrauch anhebt, Versuche in der Erkenntniß des Allgemeinen in abstracto zu machen.",
2.676,Von dem ersten Grunde des Unterschiedes der Gegenden im Raume.,
8.614,"Erster Abschnitt. Frohe Aussicht zum nahen ewigen Frieden. Von der untersten Stufe der lebenden Natur des Menschen bis zu seiner höchsten, der Philosophie.",
9.122,"Auf Plato und Aristoteles folgten die Epikuräer und die Stoiker, welche beide die abgesagtesten Feinde von einander waren. Jene setzten das höchste Gut in ein fröhliches Herz, das sie die Wollust nannten; diese fanden es einzig in der Hoheit und Stärke der Seele, bei welcher man alle Annehmlichkeiten des Lebens entbehren könne.",
9.460,Der höhere Begriff heißt auch ein weiterer; der niedere ein engerer Begriff.,
6.34,"1. Die Anlage für die Thierheit des Menschen, als eines lebenden;",
9.604,In Absicht auf die Contraposition gilt die allgemeine Regel:,
9.1852,"Sonsten giebt es auch ungemein große Spinnen in Guinea, beinahe wie eine Mannsfaust.",
8.540,I. Über die Mißhelligkeit zwischen der Moral und der Politik in Absicht auf den ewigen Frieden.,
9.751,"I . Beförderung der logischen Vollkommenheit des Erkenntnisses durch Definition, Exposition und Beschreibung der Begriffe.",
7.157,c. Von der Hypothese des Abderitisms des Menschengeschlechts Zur Vorbestimmung seiner Geschichte.,
3.714,"Es existirt überall kein schlechthin nothwendiges Wesen weder in der Welt, noch außer der Welt als ihre Ursache.",
9.410,§. 1. Begriff überhaupt und dessen Unterschied von der Anschauung.,
9.1268,"Fall bei dem Luxus eintritt, um so weniger hängen die Menschen zusammen.",
