ID,Absatz
,Wobei handelt es sich bei Künstlicher Intelligenz? Wird sie ein Segen für die Menschheit sein und intelligente Lösungen komplexer Probleme liefern?
4.657,1) Wie ist reine Mathematik möglich? 2) Wie ist reine Naturwissenschaft möglich? 3) Wie ist Metaphysik überhaupt möglich? 4) wie ist Metaphysik als Wissenschaft möglich?
5.928,"Die Physikotheologie ist der Versuch der Vernunft, aus den Zwecken der Natur (die nur empirisch erkannt werden können) auf die oberste Ursache der Natur und ihre Eigenschaften zu schließen. Eine Moraltheologie (Ethikotheologie) wäre der Versuch, aus dem moralischen Zwecke vernünftiger Wesen in der Natur (der a priori erkannt werden kann) auf jene Ursache und ihre Eigenschaften zu schließen."
3.55,"Wie ist reine Mathematik möglich? Wie ist reine Naturwissenschaft möglich? Von diesen Wissenschaften, da sie wirklich gegeben sind, läßt sich nun wohl geziemend fragen: wie sie möglich sind; denn daß sie möglich sein müssen, wird durch ihre Wirklichkeit bewiesen. *) Was aber Metaphysik betrifft, so muß ihr bisheriger schlechter Fortgang, und weil man von keiner einzigen bisher vorgetragenen, was ihren wesentlichen Zweck angeht, sagen kann, sie sei wirklich vorhanden, einen jeden mit Grunde an ihrer Möglichkeit zweifeln lassen."
8.681,"Philosophie als Lehre einer Wissenschaft kann so wie jede andere Doctrin zu allerlei beliebigen Zwecken als Werkzeug dienen, hat aber in dieser Hinsicht nur einen bedingten Werth. - Wer dieses oder jenes Product beabsichtigt, muß so oder so dabei zu Werke gehen, und wenn man hiebei nach Principien verfährt, so wird sie auch eine praktische Philosophie heißen können und hat ihren Werth, wie jede andere Waare und Arbeit, womit Verkehr getrieben werden kann."
9.84,"Man frägt doch immer am Ende, wozu dient das Philosophiren und der Endzweck desselben die Philosophie selbst als Wissenschaft nach dem Schulbegriffe betrachtet?"
9.828,"Anmerkung. Die analytische Methode heißt auch sonst die Methode des Erfindens. Für den Zweck der Popularität ist die analytische, für den Zweck der wissenschaftlichen und systematischen Bearbeitung des Erkenntnisses aber ist die synthetische Methode angemessener."
9.137,"Unser Zeitalter ist das Zeitalter der Kritik, und man muß sehen, was aus den kritischen Versuchen unsrer Zeit, in Absicht auf Philosophie und Metaphysik insbesondre, werden wird."
5.835,"Was wollen alle jene Systeme? Sie wollen unsere teleologischen Urtheile über die Natur erklären und gehen damit so zu Werke, daß ein Theil die Wahrheit derselben läugnet, mithin sie für einen Idealism der Natur (als Kunst vorgestellt) erklärt; der andere Theil sie als wahr anerkennt und die Möglichkeit einer Natur nach der Idee der Endursachen darzuthun verspricht."
9.83,"Philosophie ist also das System der philosophischen Erkenntnisse oder der Vernunfterkenntnisse aus Begriffen. Das ist der Schulbegriff von dieser Wissenschaft. Nach dem Weltbegriffe ist sie die Wissenschaft von den letzten Zwecken der menschlichen Vernunft. Dieser hohe Begriff giebt der Philosophie würde, d. i. einen absoluten Werth. Und wirklich ist sie es auch, die allein nur innern Werth hat, und allen andern Erkenntnissen erst einen Werth giebt."
9.2285,"Ein Entwurf zu einer Theorie der Erziehung ist ein herrliches Ideal, und es schadet nichts, wenn wir auch nicht gleich im Stande sind, es zu realisiren. Man muß nur nicht gleich die Idee für schimärisch halten und sie als einen schönen Traum verrufen, wenn auch Hindernisse bei ihrer Ausführung eintreten."
,Bundeskanzler
9.2243,Schweden
2.101,"Königsberg, Den 6. Jun. 1760. Ew. Gnaden gehorsamster Diener I. Kant."
9.1679,Der Elephant.
1.1040,USUS.
1.1029,USUS.
1.624,Ew. Königl. Majestät
1.28,VIII.
9.2241,Portugal
7.256,Vom Egoism.
8.148,VI.
,"Bundeskanzler, Wahl, Bundesregierung, Bundestag"
6.526,Des Rechts der häuslichen Gesellschaft zweiter Titel: Das Elternrecht.
6.534,Des Rechts der häuslichen Gesellschaft dritter Titel: Das Hausherren=Recht.
2.101,"Königsberg, Den 6. Jun. 1760. Ew. Gnaden gehorsamster Diener I. Kant."
6.199,"Viertes Stück. Vom Dienst und Afterdienst unter der Herrschaft des guten Princips, oder Von Religion und Pfaffenthum."
6.569,I. Die Erwerbungsart durch Ersitzung. § 33.
3.1,"Kritik der reinen Vernunft <!--START: not in TOC--> von Immanuel Kant, Professor in Königsberg, der Königl. Akademie der Wissenschaften in Berlin Mitglied. <!--END: not in TOC-->"
9.2307,"Die Erziehung schließt Versorgung und Bildung in sich. Diese ist 1) negativ, die Disciplin, die blos Fehler abhält; 2) positiv, die Unterweisung und Anführung, und gehört in so fern zur Cultur. Anführung ist die Leitung in der Ausübung desjenigen, was man gelehrt hat. Daher entsteht der Unterschied zwischen Informator, der blos ein Lehrer, und Hofmeister, der ein Führer ist. Jener erzieht blos für die Schule, dieser für das Leben."
8.12,Aus dem Gentelman's Magazine February 1776.
8.698,"Jena, in der Crökerschen Buchh.: Eleutheriologie oder über Freiheit und Nothwendigkeit, von Johann August Heinrich Ulrich. Zum Gebrauch der Vorlesungen in den Michaelsferien. 1788. 7 1'2 B. 8. (6 gr.)"
7.3,"<!--START: only in TOC Zueignung END: only in TOC--> Dem Herrn Carl Friedrich Stäudlin, Doctor und Professor in Göttingen, zugeeignet von dem Verfasser."
,Welche Aufgaben hat der Bundeskanzler aktuell außer Deutschland zu repräsentieren?
8.402,II. Vom Verhältniß der Theorie zur Praxis im Staatsrecht. (Gegen Hobbes.)
7.795,Das weibliche Geschlecht muß sich im Praktischen selbst ausbilden und discipliniren; das männliche versteht sich darauf nicht. Der junge Ehemann herrscht über seine ältere Ehefrau. Dieses
6.1065,Von der Liebespflicht insbesondere. § 26.
6.918,Erster Theil. Von den Pflichten gegen sich selbst überhaupt.
8.508,"Zweiter Abschnitt, Welcher die Definitivartikel zum ewigen Frieden unter Staaten enthält."
6.526,Des Rechts der häuslichen Gesellschaft zweiter Titel: Das Elternrecht.
6.674,Von dem rechtlichen Verhältnisse des Bürgers zum Vaterlande und zum Auslande.
6.834,VIII. Exposition der Tugendpflichten als weiter Pflichten.
6.755,6. Vom Recht der Ersitzung.
6.199,"Viertes Stück. Vom Dienst und Afterdienst unter der Herrschaft des guten Princips, oder Von Religion und Pfaffenthum."
