ID,Absatz
8.510,Erster Definitivartikel zum ewigen Frieden. Die bürgerliche Verfassung in jedem Staate soll republikanisch sein.
6.655,"C. Dem Oberbefehlshaber steht indirect, d. i. als Übernehmer der Pflicht des Volks, das Recht zu, dieses mit Abgaben zu seiner (des Volks) eigenen Erhaltung zu belasten, als da sind: das Armenwesen, die Findelhäuser und das Kirchenwesen, sonst milde oder fromme Stiftungen genannt."
7.6,"König Friedrich Wilhelm II. , ein tapferer, redlicher, menschenliebender und - von gewissen Temperamentseigenschaften abgesehen durchaus vortrefflicher Herr, der auch mich persönlich kannte und von Zeit zu Zeit Äußerungen seiner Gnade an mich gelangen ließ, hatte auf Anregung eines Geistlichen, nachmals zum Minister im geistlichen Departement erhobenen Mannes, dem man billigerweise auch keine andere, als auf seine innere Überzeugung sich gründende gut gemeinte Absichten unterzulegen Ursache hat, -im Jahr 1788 ein Religionsedict, bald nachher ein die Schriftstellerei überhaupt sehr einschränkendes, mithin auch jenes mit schärfendes Censuredict ergehen lassen. Man kann nicht in Abrede ziehen: daß gewisse Vorzeichen, die der Explosion, welche nachher erfolgte, vorhergingen, der Regierung die Nothwendigkeit einer Reform in jenem Fache anräthig machen mußten; welches auf dem stillen Wege des akademischen Unterrichts künftiger öffentlicher Volkslehrer zu erreichen war: denn diese hatten als junge Geistliche ihren Kanzelvortrag auf solchen Ton gestimmt, daß, wer Scherz versteht, sich durch solche Lehrer eben nicht wird bekehren lassen."
2.86,"Gedanken bei dem frühzeitigen Ableben des <!--START: not in TOC--> Hochwohlgebornen Herrn, <!--END: not in TOC--> HERRN Johann Friedrich von Funk, <!--START: not in TOC--> in einem Sendschreiben an die Hochwohlgeborne Frau, FRAU Agnes Elisabeth, verwitt. Frau Rittmeisterin von Funk, geborne von Dorthösen, Erbfrau der Kaywenschen und Kahrenschen Güter in Kurland, des selig Verstorbenen Hochbetrübte Frau Mutter, von M. IMMANUEL KANT, Lehrer der Weltweisheit auf der Akademie zu Königsberg. <!--END: not in TOC-->"
6.584,"Die moralische Person, welche der Gerechtigkeit vorsteht, ist der Gerichtshof ( forum ) und im Zustande ihrer Amtsführung das Gericht ( iudicium ): alles nur nach Rechtsbedingungen a priori gedacht, ohne, wie eine solche Verfassung wirklich einzurichten und zu organisiren sei (wozu Statute, also empirische Principien, gehören), in Betrachtung zu ziehen."
6.534,Des Rechts der häuslichen Gesellschaft dritter Titel: Das Hausherren=Recht.
6.645,"Hieraus folgt nun der Satz: der Herrscher im Staat hat gegen den Unterthan lauter Rechte und keine (Zwangs-)Pflichten. - Ferner, wenn das Organ des Herrschers, der Regent, auch den Gesetzen zuwider verführe, z. B. mit Auflagen, Recrutirungen u. dergl. wider das Gesetz der Gleichheit in Vertheilung der Staatslasten, so darf der Unterthan dieser Ungerechtigkeit zwar Beschwerden ( gravamina ), aber keinen Widerstand entgegensetzen."
,Welche Aufgaben hat der Bundeskanzler aktuell außer Deutschland zu repräsentieren?
6.922,§ 2. Es giebt doch Pflichten des Menschen gegen sich selbst.
8.503,"5. ""Kein Staat soll sich in die Verfassung und Regierung eines andern Staats gewaltthätig einmischen."""
7.466,"Der unter gemessenen Befehlen stehende Haus- oder Staatsdiener braucht nur Verstand zu haben; der Officier, dem für das ihm aufgetragene Geschäfte nur die allgemeine Regel vorgeschrieben und nun überlassen wird, was in vorkommendem Falle zu thun sei, selbst zu bestimmen, bedarf Urtheilskraft; der General, der die möglichen Fälle beurtheilen und für sie sich die Regel selbst ausdenken soll, muß Vernunft besitzen. Die zu diesen verschiedenen Vorkehrungen erforderlichen Talente sind sehr verschieden. ""Mancher glänzt auf der zweiten Stufe, welcher auf der obersten unsichtbar wird"" ( Tel brille au second rang, qui s'eclipse au premier )."
7.795,Das weibliche Geschlecht muß sich im Praktischen selbst ausbilden und discipliniren; das männliche versteht sich darauf nicht. Der junge Ehemann herrscht über seine ältere Ehefrau. Dieses
6.645,"Hieraus folgt nun der Satz: der Herrscher im Staat hat gegen den Unterthan lauter Rechte und keine (Zwangs-)Pflichten. - Ferner, wenn das Organ des Herrschers, der Regent, auch den Gesetzen zuwider verführe, z. B. mit Auflagen, Recrutirungen u. dergl. wider das Gesetz der Gleichheit in Vertheilung der Staatslasten, so darf der Unterthan dieser Ungerechtigkeit zwar Beschwerden ( gravamina ), aber keinen Widerstand entgegensetzen."
6.1006,"Erster Abschnitt. Von der Pflicht des Menschen gegen sich selbst, als den angebornen Richter über sich selbst."
6.1054,Erster Abschnitt. Von der Liebespflicht gegen andere Menschen.
7.493,"Der Klerus hält den Laiker strenge und beständig in seiner Unmündigkeit. Das Volk hat keine Stimme und kein Urtheil in Ansehung des Weges, den es zum Himmelreich zu nehmen hat. Es bedarf nicht eigener Augen des Menschen, um dahin zu gelangen; man wird ihn schon leiten, und wenn ihm gleich heilige Schriften in die Hände gegeben werden, um mit eigenen Augen zu sehen, so wird er doch zugleich von seinen Leitern gewarnt, ""nichts anders darin zu finden, als was diese darin zu finden versichern"", und überall ist mechanische Handhabung der Menschen unter dem Regiment Anderer das sicherste Mittel zu Befolgung einer gesetzlichen Ordnung."
6.155,"Vernunftreligion und Schriftgelehrsamkeit sind also die eigentlichen berufenen Ausleger und Depositäre einer heiligen Urkunde. Es fällt in die Augen, daß diese an öffentlichem Gebrauche ihrer Einsichten und Entdeckungen in diesem Felde vom weltlichen Arm schlechterdings nicht können gehindert und an gewisse Glaubenssätze gebunden werden: weil sonst Laien die Kleriker nöthigen würden, in ihre Meinung einzutreten, die jene doch nur von dieser ihrer Belehrung her haben. Wenn der Staat nur dafür sorgt, daß es nicht an Gelehrten und ihrer Moralität nach im guten Rufe stehenden Männern fehle, welche das Ganze des Kirchenwesens verwalten, deren Gewissen er diese Besorgung anvertraut, so hat er alles gethan, was seine Pflicht und Befugnis mit sich bringen. Diese selbst aber in die Schule zu führen und sich mit ihren Streitigkeiten zu befassen (die, wenn sie nur nicht von Kanzeln geführt werden, das Kirchenpublicum im völligen Frieden lassen), ist eine Zumuthung, die das Publicum an den Gesetzgeber nicht ohne Unbescheidenheit thun kann, weil sie unter seiner Würde ist."
9.2425,"Viele haben den Abschnitt der Moral, der die Lehre von den Pflichten gegen sich selbst enthält, ganz übersehen oder falsch erklärt, wie Crugott. Die Pflicht gegen sich selbst aber besteht, wie gesagt, darin, daß der Mensch die Würde der Menschheit in seiner eignen Person bewahre. Er tadelt sich, wenn er die Idee der Menschheit vor Augen hat. Er hat ein Original in seiner Idee, mit dem er sich vergleicht. Wenn die Zahl der Jahre anwächst, wenn die Neigung zum Geschlechte sich zu regen beginnt, dann ist der kritische Zeitpunkt, in dem die Würde des Menschen allein im Stande ist, den Jüngling in Schranken zu halten. Frühe muß man aber dem Jünglinge Winke geben, wie er sich vor diesem oder jenem zu bewahren habe. *)"
